,type,name,author,event,year
139,c,Unconstrained Face Alignment via Cascaded Compositional Learning.,"['Shizhan Zhu', 'Cheng Li', 'Chen Change Loy', 'Xiaoou Tang']",CVPR,2016
140,c,Unsupervised Learning of Discriminative Attributes and Visual Representations.,"['Chen Huang', 'Chen Change Loy', 'Xiaoou Tang']",CVPR,2016
141,c,Learning Deep Representation for Imbalanced Classification.,"['Chen Huang', 'Yining Li', 'Chen Change Loy', 'Xiaoou Tang']",CVPR,2016
142,c,WIDER FACE: A Face Detection Benchmark.,"['Shuo Yang', 'Ping Luo', 'Chen Change Loy', 'Xiaoou Tang']",CVPR,2016
143,c,Slicing Convolutional Neural Network for Crowd Video Understanding.,"['Jing Shao', 'Chen Change Loy', 'Kai Kang', 'Xiaogang Wang']",CVPR,2016
144,c,Joint Face Representation Adaptation and Clustering in Videos.,"['Zhanpeng Zhang', 'Ping Luo', 'Chen Change Loy', 'Xiaoou Tang']",ECCV (3),2016
145,c,Depth Map Super-Resolution by Deep Multi-Scale Guidance.,"['Tak-Wai Hui', 'Chen Change Loy', 'Xiaoou Tang']",ECCV (3),2016
146,c,Deep Specialized Network for Illuminant Estimation.,"['Wu Shi', 'Chen Change Loy', 'Xiaoou Tang']",ECCV (4),2016
147,c,Accelerating the Super-Resolution Convolutional Neural Network.,"['Chao Dong', 'Chen Change Loy', 'Xiaoou Tang']",ECCV (2),2016
148,c,Deep Cascaded Bi-Network for Face Hallucination.,"['Shizhan Zhu', 'Sifei Liu', 'Chen Change Loy', 'Xiaoou Tang']",ECCV (5),2016
149,c,Human Attribute Recognition by Deep Hierarchical Contexts.,"['Yining Li', 'Chen Huang', 'Chen Change Loy', 'Xiaoou Tang']",ECCV (6),2016
150,c,Towards robust color recovery for high-capacity color QR codes.,"['Zhibo Yang', 'Zhiyi Cheng', 'Chen Change Loy', 'Wing Cheong Lau', 'Chak Man Li', 'Guanchen Li']",ICIP,2016
151,c,Local Similarity-Aware Deep Feature Embedding.,"['Chen Huang', 'Chen Change Loy', 'Xiaoou Tang']",NIPS,2016
152,c,Deep Representation Learning with Target Coding.,"['Shuo Yang', 'Ping Luo', 'Chen Change Loy', 'Kenneth W. Shum', 'Xiaoou Tang']",AAAI,2015
153,c,DeepID-Net: Deformable deep convolutional neural networks for object detection.,"['Wanli Ouyang', 'Xiaogang Wang', 'Xingyu Zeng', 'Shi Qiu', 'Ping Luo', 'Yonglong Tian', 'Hongsheng Li', 'Shuo Yang', 'Zhe Wang', 'Chen Change Loy', 'Xiaoou Tang']",CVPR,2015
154,c,A large-scale car dataset for fine-grained categorization and verification.,"['Linjie Yang', 'Ping Luo', 'Chen Change Loy', 'Xiaoou Tang']",CVPR,2015
155,c,Deeply learned attributes for crowded scene understanding.,"['Jing Shao', 'Kai Kang', 'Chen Change Loy', 'Xiaogang Wang']",CVPR,2015
156,c,Face alignment by coarse-to-fine shape searching.,"['Shizhan Zhu', 'Cheng Li', 'Chen Change Loy', 'Xiaoou Tang']",CVPR,2015
157,c,Compression Artifacts Reduction by a Deep Convolutional Network.,"['Chao Dong', 'Yubin Deng', 'Chen Change Loy', 'Xiaoou Tang']",ICCV,2015
158,c,Semantic Image Segmentation via Deep Parsing Network.,"['Ziwei Liu', 'Xiaoxiao Li', 'Ping Luo', 'Chen Change Loy', 'Xiaoou Tang']",ICCV,2015
159,c,Learning Social Relation Traits from Face Images.,"['Zhanpeng Zhang', 'Ping Luo', 'Chen Change Loy', 'Xiaoou Tang']",ICCV,2015
160,c,From Facial Parts Responses to Face Detection: A Deep Learning Approach.,"['Shuo Yang', 'Ping Luo', 'Chen Change Loy', 'Xiaoou Tang']",ICCV,2015
161,c,Constructing Robust Affinity Graphs for Spectral Clustering.,"['Xiatian Zhu', 'Chen Change Loy', 'Shaogang Gong']",CVPR,2014
162,c,Scene-Independent Group Profiling in Crowd.,"['Jing Shao', 'Chen Change Loy', 'Xiaogang Wang']",CVPR,2014
163,c,Facial Landmark Detection by Deep Multi-task Learning.,"['Zhanpeng Zhang', 'Ping Luo', 'Chen Change Loy', 'Xiaoou Tang']",ECCV (6),2014
164,c,Learning a Deep Convolutional Network for Image Super-Resolution.,"['Chao Dong', 'Chen Change Loy', 'Kaiming He', 'Xiaoou Tang']",ECCV (4),2014
165,c,Crowd Saliency Detection via Global Similarity Structure.,"['Mei Kuan Lim', 'Ven Jyn Kok', 'Chen Change Loy', 'Chee Seng Chan']",ICPR,2014
166,c,Pedestrian Attribute Recognition At Far Distance.,"['Yubin Deng', 'Ping Luo', 'Chen Change Loy', 'Xiaoou Tang']",ACM Multimedia,2014
167,c,Cumulative Attribute Space for Age and Crowd Density Estimation.,"['Ke Chen', 'Shaogang Gong', 'Tao Xiang', 'Chen Change Loy']",CVPR,2013
168,c,Video Synopsis by Heterogeneous Multi-source Correlation.,"['Xiatian Zhu', 'Chen Change Loy', 'Shaogang Gong']",ICCV,2013
169,c,POP: Person Re-identification Post-rank Optimisation.,"['Chunxiao Liu', 'Chen Change Loy', 'Shaogang Gong', 'Guijin Wang']",ICCV,2013
170,c,From Semi-supervised to Transfer Counting of Crowds.,"['Chen Change Loy', 'Shaogang Gong', 'Tao Xiang']",ICCV,2013
171,c,Constrained Clustering: Effective Constraint Propagation with Imperfect Oracles.,"['Xiatian Zhu', 'Chen Change Loy', 'Shaogang Gong']",ICDM,2013
172,c,Person re-identification by manifold ranking.,"['Chen Change Loy', 'Chunxiao Liu', 'Shaogang Gong']",ICIP,2013
173,c,Feature Mining for Localised Crowd Counting.,"['Ke Chen', 'Chen Change Loy', 'Shaogang Gong', 'Tony Xiang']",BMVC,2012
174,c,Comparing Visual Feature Coding for Learning Disjoint Camera Dependencies.,"['Xiatian Zhu', 'Shaogang Gong', 'Chen Change Loy']",BMVC,2012
175,c,Stream-based joint exploration-exploitation active learning.,"['Chen Change Loy', 'Timothy M. Hospedales', 'Tao Xiang', 'Shaogang Gong']",CVPR,2012
176,c,Person Re-identification: What Features Are Important?,"['Chunxiao Liu', 'Shaogang Gong', 'Chen Change Loy', 'Xinggang Lin']",ECCV Workshops (1),2012
177,c,Salient motion detection in crowded scenes.,"['Chen Change Loy', 'Tao Xiang', 'Shaogang Gong']",ISCCSP,2012
178,c,Stream-Based Active Unusual Event Detection.,"['Chen Change Loy', 'Tao Xiang', 'Shaogang Gong']",ACCV (1),2010
179,c,Modelling Multi-object Activity by Gaussian Processes.,"['Chen Change Loy', 'Tao Xiang', 'Shaogang Gong']",BMVC,2009
180,c,Multi-camera activity correlation analysis.,"['Chen Change Loy', 'Tao Xiang', 'Shaogang Gong']",CVPR,2009
181,c,Modelling activity global temporal dependencies using Time Delayed Probabilistic Graphical Model.,"['Chen Change Loy', 'Tao Xiang', 'Shaogang Gong']",ICCV,2009
182,c,Robust modular ARTMAP for multi-class shape recognition.,"['Chue Poh Tan', 'Chen Change Loy', 'Weng-Kin Lai', 'Chee Peng Lim']",IJCNN,2008
183,c,Use of Circle-Segments as a Data Visualization Technique for Feature Selection in Pattern Classification.,"['Shir Li Wang', 'Chen Change Loy', 'Chee Peng Lim', 'Weng-Kin Lai', 'Kay Sin Tan']",ICONIP (1),2007
184,c,Keystroke Patterns Classification Using the ARTMAP-FD Neural Network.,"['Chen Change Loy', 'Weng-Kin Lai', 'Chee Peng Lim']",IIH-MSP,2007
185,c,Dimensionality Reduction of Protein Mass Spectrometry Data Using Random Projection.,"['Chen Change Loy', 'Weng-Kin Lai', 'Chee Peng Lim']",ICONIP (2),2006
186,i,LEDNet: Joint Low-light Enhancement and Deblurring in the Dark.,"['Shangchen Zhou', 'Chongyi Li', 'Chen Change Loy']",CoRR,2022
187,i,Conditional Prompt Learning for Vision-Language Models.,"['Kaiyang Zhou', 'Jingkang Yang', 'Chen Change Loy', 'Ziwei Liu']",CoRR,2022
188,i,Dense Siamese Network.,"['Wenwei Zhang', 'Jiangmiao Pang', 'Kai Chen', 'Chen Change Loy']",CoRR,2022
189,i,Open-Vocabulary DETR with Conditional Matching.,"['Yuhang Zang', 'Wei Li', 'Kaiyang Zhou', 'Chen Huang', 'Chen Change Loy']",CoRR,2022
190,i,Bailando: 3D Dance Generation by Actor-Critic GPT with Choreographic Memory.,"['Siyao Li', 'Weijiang Yu', 'Tianpei Gu', 'Chunze Lin', 'Quan Wang', 'Chen Qian', 'Chen Change Loy', 'Ziwei Liu']",CoRR,2022
191,i,Pastiche Master: Exemplar-Based High-Resolution Portrait Style Transfer.,"['Shuai Yang', 'Liming Jiang', 'Ziwei Liu', 'Chen Change Loy']",CoRR,2022
192,i,TransEditor: Transformer-Based Dual-Space GAN for Highly Controllable Facial Editing.,"['Yanbo Xu', 'Yueqin Yin', 'Liming Jiang', 'Qianyi Wu', 'Chengyao Zheng', 'Chen Change Loy', 'Bo Dai', 'Wayne Wu']",CoRR,2022
193,i,Unsupervised Image-to-Image Translation with Generative Prior.,"['Shuai Yang', 'Liming Jiang', 'Ziwei Liu', 'Chen Change Loy']",CoRR,2022
194,i,"Video K-Net: A Simple, Strong, and Unified Baseline for Video Segmentation.","['Xiangtai Li', 'Wenwei Zhang', 'Jiangmiao Pang', 'Kai Chen', 'Guangliang Cheng', 'Yunhai Tong', 'Chen Change Loy']",CoRR,2022
195,i,On the Generalization of BasicVSR++ to Video Deblurring and Denoising.,"['Kelvin C. K. Chan', 'Shangchen Zhou', 'Xiangyu Xu', 'Chen Change Loy']",CoRR,2022
196,i,StyleGAN-Human: A Data-Centric Odyssey of Human Generation.,"['Jianglin Fu', 'Shikai Li', 'Yuming Jiang', 'Kwan-Yee Lin', 'Chen Qian', 'Chen Change Loy', 'Wayne Wu', 'Ziwei Liu']",CoRR,2022
197,i,HuMMan: Multi-Modal 4D Human Dataset for Versatile Sensing and Modeling.,"['Zhongang Cai', 'Daxuan Ren', 'Ailing Zeng', 'Zhengyu Lin', 'Tao Yu', 'Wenjia Wang', 'Xiangyu Fan', 'Yang Gao', 'Yifan Yu', 'Liang Pan', 'Fangzhou Hong', 'Mingyuan Zhang', 'Chen Change Loy', 'Lei Yang', 'Ziwei Liu']",CoRR,2022
198,i,Delving into High-Quality Synthetic Face Occlusion Segmentation Datasets.,"['Kenny T. R. Voo', 'Liming Jiang', 'Chen Change Loy']",CoRR,2022
199,i,Text2Human: Text-Driven Controllable Human Image Generation.,"['Yuming Jiang', 'Shuai Yang', 'Haonan Qiu', 'Wayne Wu', 'Chen Change Loy', 'Ziwei Liu']",CoRR,2022
200,i,Point-to-Voxel Knowledge Distillation for LiDAR Semantic Segmentation.,"['Yuenan Hou', 'Xinge Zhu', 'Yuexin Ma', 'Chen Change Loy', 'Yikang Li']",CoRR,2022
201,i,Masked Frequency Modeling for Self-Supervised Visual Pre-Training.,"['Jiahao Xie', 'Wei Li', 'Xiaohang Zhan', 'Ziwei Liu', 'Yew Soon Ong', 'Chen Change Loy']",CoRR,2022
202,i,Towards Robust Blind Face Restoration with Codebook Lookup Transformer.,"['Shangchen Zhou', 'Kelvin C. K. Chan', 'Chongyi Li', 'Chen Change Loy']",CoRR,2022
203,i,Monocular 3D Object Reconstruction with GAN Inversion.,"['Junzhe Zhang', 'Daxuan Ren', 'Zhongang Cai', 'Chai Kiat Yeo', 'Bo Dai', 'Chen Change Loy']",CoRR,2022
204,i,BRACE: The Breakdancing Competition Dataset for Dance Motion Synthesis.,"['Davide Moltisanti', 'Jinyi Wu', 'Bo Dai', 'Chen Change Loy']",CoRR,2022
205,i,Transformer with Implicit Edges for Particle-based Physics Simulation.,"['Yidi Shao', 'Chen Change Loy', 'Bo Dai']",CoRR,2022
206,i,CelebV-HQ: A Large-Scale Video Facial Attributes Dataset.,"['Hao Zhu', 'Wayne Wu', 'Wentao Zhu', 'Liming Jiang', 'Siwei Tang', 'Li Zhang', 'Ziwei Liu', 'Chen Change Loy']",CoRR,2022
207,i,Exploring CLIP for Assessing the Look and Feel of Images.,"['Jianyi Wang', 'Kelvin C. K. Chan', 'Chen Change Loy']",CoRR,2022
208,i,CuDi: Curve Distillation for Efficient and Controllable Exposure Adjustment.,"['Chongyi Li', 'Chunle Guo', 'Ruicheng Feng', 'Shangchen Zhou', 'Chen Change Loy']",CoRR,2022
209,i,StyleLight: HDR Panorama Generation for Lighting Estimation and Editing.,"['Guangcong Wang', 'Yinuo Yang', 'Chen Change Loy', 'Ziwei Liu']",CoRR,2022
210,i,GLEAN: Generative Latent Bank for Image Super-Resolution and Beyond.,"['Kelvin C. K. Chan', 'Xiangyu Xu', 'Xintao Wang', 'Jinwei Gu', 'Chen Change Loy']",CoRR,2022
211,i,Mind the Gap in Distilling StyleGANs.,"['Guodong Xu', 'Yuenan Hou', 'Ziwei Liu', 'Chen Change Loy']",CoRR,2022
212,i,MIPI 2022 Challenge on Under-Display Camera Image Restoration: Methods and Results.,"['Ruicheng Feng', 'Chongyi Li', 'Shangchen Zhou', 'Wenxiu Sun', 'Qingpeng Zhu', 'Jun Jiang', 'Qingyu Yang', 'Chen Change Loy', 'Jinwei Gu']",CoRR,2022
213,i,MIPI 2022 Challenge on RGB+ToF Depth Completion: Dataset and Report.,"['Wenxiu Sun', 'Qingpeng Zhu', 'Chongyi Li', 'Ruicheng Feng', 'Shangchen Zhou', 'Jun Jiang', 'Qingyu Yang', 'Chen Change Loy', 'Jinwei Gu']",CoRR,2022
214,i,MIPI 2022 Challenge on Quad-Bayer Re-mosaic: Dataset and Report.,"['Qingyu Yang', 'Guang Yang', 'Jun Jiang', 'Chongyi Li', 'Ruicheng Feng', 'Shangchen Zhou', 'Wenxiu Sun', 'Qingpeng Zhu', 'Chen Change Loy', 'Jinwei Gu']",CoRR,2022
215,i,On-Device Domain Generalization.,"['Kaiyang Zhou', 'Yuanhan Zhang', 'Yuhang Zang', 'Jingkang Yang', 'Chen Change Loy', 'Ziwei Liu']",CoRR,2022
216,i,MIPI 2022 Challenge on RGBW Sensor Fusion: Dataset and Report.,"['Qingyu Yang', 'Guang Yang', 'Jun Jiang', 'Chongyi Li', 'Ruicheng Feng', 'Shangchen Zhou', 'Wenxiu Sun', 'Qingpeng Zhu', 'Chen Change Loy', 'Jinwei Gu']",CoRR,2022
217,i,MIPI 2022 Challenge on RGBW Sensor Re-mosaic: Dataset and Report.,"['Qingyu Yang', 'Guang Yang', 'Jun Jiang', 'Chongyi Li', 'Ruicheng Feng', 'Shangchen Zhou', 'Wenxiu Sun', 'Qingpeng Zhu', 'Chen Change Loy', 'Jinwei Gu']",CoRR,2022
218,i,VToonify: Controllable High-Resolution Portrait Video Style Transfer.,"['Shuai Yang', 'Liming Jiang', 'Ziwei Liu', 'Chen Change Loy']",CoRR,2022
219,i,Deep Fourier Up-Sampling.,"['Man Zhou', 'Hu Yu', 'Jie Huang', 'Feng Zhao', 'Jinwei Gu', 'Chen Change Loy', 'Deyu Meng', 'Chongyi Li']",CoRR,2022
220,i,Flare7K: A Phenomenological Nighttime Flare Removal Dataset.,"['Yuekun Dai', 'Chongyi Li', 'Shangchen Zhou', 'Ruicheng Feng', 'Chen Change Loy']",CoRR,2022
221,i,Unified Vision and Language Prompt Learning.,"['Yuhang Zang', 'Wei Li', 'Kaiyang Zhou', 'Chen Huang', 'Chen Change Loy']",CoRR,2022
222,i,DeeperForensics Challenge 2020 on Real-World Face Forgery Detection: Methods and Results.,"['Liming Jiang', 'Zhengkui Guo', 'Wayne Wu', 'Zhaoyang Liu', 'Ziwei Liu', 'Chen Change Loy', 'Shuo Yang', 'Yuanjun Xiong', 'Wei Xia', 'Baoying Chen', 'Peiyu Zhuang', 'Sili Li', 'Shen Chen', 'Taiping Yao', 'Shouhong Ding', 'Jilin Li', 'Feiyue Huang', 'Liujuan Cao', 'Rongrong Ji', 'Changlei Lu', 'Ganchao Tan']",CoRR,2021
223,i,FASA: Feature Augmentation and Sampling Adaptation for Long-Tailed Instance Segmentation.,"['Yuhang Zang', 'Chen Huang', 'Chen Change Loy']",CoRR,2021
224,i,Learning to Enhance Low-Light Image via Zero-Reference Deep Curve Estimation.,"['Chongyi Li', 'Chunle Guo', 'Chen Change Loy']",CoRR,2021
225,i,Network Pruning via Resource Reallocation.,"['Yuenan Hou', 'Zheng Ma', 'Chunxiao Liu', 'Zhe Wang', 'Chen Change Loy']",CoRR,2021
226,i,Domain Generalization: A Survey.,"['Kaiyang Zhou', 'Ziwei Liu', 'Yu Qiao', 'Tao Xiang', 'Chen Change Loy']",CoRR,2021
227,i,Deep Animation Video Interpolation in the Wild.,"['Siyao Li', 'Shiyu Zhao', 'Weijiang Yu', 'Wenxiu Sun', 'Dimitris N. Metaxas', 'Chen Change Loy', 'Ziwei Liu']",CoRR,2021
228,i,Everything's Talkin': Pareidolia Face Reenactment.,"['Linsen Song', 'Wayne Wu', 'Chaoyou Fu', 'Chen Qian', 'Chen Change Loy', 'Ran He']",CoRR,2021
229,i,Audio-Driven Emotional Video Portraits.,"['Xinya Ji', 'Hang Zhou', 'Kaisiyuan Wang', 'Wayne Wu', 'Chen Change Loy', 'Xun Cao', 'Feng Xu']",CoRR,2021
230,i,Removing Diffraction Image Artifacts in Under-Display Camera via Dynamic Skip Connection Network.,"['Ruicheng Feng', 'Chongyi Li', 'Huaijin Chen', 'Shuai Li', 'Chen Change Loy', 'Jinwei Gu']",CoRR,2021
231,i,Lighting the Darkness in the Deep Learning Era.,"['Chongyi Li', 'Chunle Guo', 'Linghao Han', 'Jun Jiang', 'Ming-Ming Cheng', 'Jinwei Gu', 'Chen Change Loy']",CoRR,2021
232,i,NTIRE 2021 Challenge on Quality Enhancement of Compressed Video: Methods and Results.,"['Ren Yang', 'Radu Timofte', 'Jing Liu', 'Yi Xu', 'Xinjian Zhang', 'Minyi Zhao', 'Shuigeng Zhou', 'Kelvin C. K. Chan', 'Shangchen Zhou', 'Xiangyu Xu', 'Chen Change Loy', 'Xin Li', 'Fanglong Liu', 'He Zheng', 'Lielin Jiang', 'Qi Zhang', 'Dongliang He', 'Fu Li', 'Qingqing Dang', 'Yibin Huang', 'Matteo Maggioni', 'Zhongqian Fu', 'Shuai Xiao', 'Cheng Li', 'Thomas Tanay', 'Fenglong Song', 'Wentao Chao', 'Qiang Guo', 'Yan Liu', 'Jiang Li', 'Xiaochao Qu', 'Dewang Hou', 'Jiayu Yang', 'Lyn Jiang', 'Di You', 'Zhenyu Zhang', 'Chong Mou', 'Iaroslav Koshelev', 'Pavel Ostyakov', 'Andrey Somov', 'Jia Hao', 'Xueyi Zou', 'Shijie Zhao', 'Xiaopeng Sun', 'Yiting Liao', 'Yuanzhi Zhang', 'Qing Wang', 'Gen Zhan', 'Mengxi Guo', 'Junlin Li', 'Ming Lu', 'Zhan Ma', 'Pablo Navarrete Michelini', 'Hai Wang', 'Yiyun Chen', 'Jingyu Guo', 'Liliang Zhang', 'Wenming Yang', 'Sijung Kim', 'Syehoon Oh', 'Yucong Wang', 'Minjie Cai', 'Wei Hao', 'Kangdi Shi', 'Liangyan Li', 'Jun Chen', 'Wei Gao', 'Wang Liu', 'Xiaoyu Zhang', 'Linjie Zhou', 'Sixin Lin', 'Ru Wang']",CoRR,2021
233,i,Pose-Controllable Talking Face Generation by Implicitly Modularized Audio-Visual Representation.,"['Hang Zhou', 'Yasheng Sun', 'Wayne Wu', 'Chen Change Loy', 'Xiaogang Wang', 'Ziwei Liu']",CoRR,2021
234,i,Unsupervised 3D Shape Completion through GAN Inversion.,"['Junzhe Zhang', 'Xinyi Chen', 'Zhongang Cai', 'Liang Pan', 'Haiyu Zhao', 'Shuai Yi', 'Chai Kiat Yeo', 'Bo Dai', 'Chen Change Loy']",CoRR,2021
235,i,BasicVSR++: Improving Video Super-Resolution with Enhanced Propagation and Alignment.,"['Kelvin C. K. Chan', 'Shangchen Zhou', 'Xiangyu Xu', 'Chen Change Loy']",CoRR,2021
236,i,Semi-Supervised Domain Generalization with Stochastic StyleMatch.,"['Kaiyang Zhou', 'Chen Change Loy', 'Ziwei Liu']",CoRR,2021
237,i,Robust Reference-based Super-Resolution via C2-Matching.,"['Yuming Jiang', 'Kelvin C. K. Chan', 'Xintao Wang', 'Chen Change Loy', 'Ziwei Liu']",CoRR,2021
238,i,Unsupervised Object-Level Representation Learning from Scene Images.,"['Jiahao Xie', 'Xiaohang Zhan', 'Ziwei Liu', 'Yew-Soon Ong', 'Chen Change Loy']",CoRR,2021
239,i,K-Net: Towards Unified Image Segmentation.,"['Wenwei Zhang', 'Jiangmiao Pang', 'Kai Chen', 'Chen Change Loy']",CoRR,2021
240,i,Learning to Prompt for Vision-Language Models.,"['Kaiyang Zhou', 'Jingkang Yang', 'Chen Change Loy', 'Ziwei Liu']",CoRR,2021
241,i,3D Human Texture Estimation from a Single Image with Transformers.,"['Xiangyu Xu', 'Chen Change Loy']",CoRR,2021
242,i,Talk-to-Edit: Fine-Grained Facial Editing via Dialog.,"['Yuming Jiang', 'Ziqi Huang', 'Xingang Pan', 'Chen Change Loy', 'Ziwei Liu']",CoRR,2021
243,i,ReconfigISP: Reconfigurable Camera Image Processing Pipeline.,"['Ke Yu', 'Zexian Li', 'Yue Peng', 'Chen Change Loy', 'Jinwei Gu']",CoRR,2021
244,i,Temporally Consistent Video Colorization with Deep Feature Propagation and Self-regularization Learning.,"['Yihao Liu', 'Hengyuan Zhao', 'Kelvin C. K. Chan', 'Xintao Wang', 'Chen Change Loy', 'Yu Qiao', 'Chao Dong']",CoRR,2021
245,i,Playing for 3D Human Recovery.,"['Zhongang Cai', 'Mingyuan Zhang', 'Jiawei Ren', 'Chen Wei', 'Daxuan Ren', 'Jiatong Li', 'Zhengyu Lin', 'Haiyu Zhao', 'Shuai Yi', 'Lei Yang', 'Chen Change Loy', 'Ziwei Liu']",CoRR,2021
246,i,"Self-Supervised Representation Learning: Introduction, Advances and Challenges.","['Linus Ericsson', 'Henry Gouk', 'Chen Change Loy', 'Timothy M. Hospedales']",CoRR,2021
247,i,STransGAN: An Empirical Study on Transformer in GANs.,"['Rui Xu', 'Xiangyu Xu', 'Kai Chen', 'Bolei Zhou', 'Chen Change Loy']",CoRR,2021
248,i,A Shading-Guided Generative Implicit Model for Shape-Accurate 3D-Aware Image Synthesis.,"['Xingang Pan', 'Xudong Xu', 'Chen Change Loy', 'Christian Theobalt', 'Bo Dai']",CoRR,2021
249,i,Monocular 3D Reconstruction of Interacting Hands via Collision-Aware Factorized Refinements.,"['Yu Rong', 'Jingbo Wang', 'Ziwei Liu', 'Chen Change Loy']",CoRR,2021
250,i,Deceive D: Adaptive Pseudo Augmentation for GAN Training with Limited Data.,"['Liming Jiang', 'Bo Dai', 'Wayne Wu', 'Chen Change Loy']",CoRR,2021
251,i,Investigating Tradeoffs in Real-World Video Super-Resolution.,"['Kelvin C. K. Chan', 'Shangchen Zhou', 'Xiangyu Xu', 'Chen Change Loy']",CoRR,2021
252,i,DenseCLIP: Extract Free Dense Labels from CLIP.,"['Chong Zhou', 'Chen Change Loy', 'Bo Dai']",CoRR,2021
253,i,MoCaNet: Motion Retargeting in-the-wild via Canonicalization Networks.,"['Wentao Zhu', 'Zhuoqian Yang', 'Ziang Di', 'Wayne Wu', 'Yizhou Wang', 'Chen Change Loy']",CoRR,2021
254,i,EcoNAS: Finding Proxies for Economical Neural Architecture Search.,"['Dongzhan Zhou', 'Xinchi Zhou', 'Wenwei Zhang', 'Chen Change Loy', 'Shuai Yi', 'Xuesen Zhang', 'Wanli Ouyang']",CoRR,2020
255,i,DeeperForensics-1.0: A Large-Scale Dataset for Real-World Face Forgery Detection.,"['Liming Jiang', 'Wayne Wu', 'Ren Li', 'Chen Qian', 'Chen Change Loy']",CoRR,2020
256,i,Everybody's Talkin': Let Me Talk as You Want.,"['Linsen Song', 'Wayne Wu', 'Chen Qian', 'Ran He', 'Chen Change Loy']",CoRR,2020
257,i,Zero-Reference Deep Curve Estimation for Low-Light Image Enhancement.,"['Chunle Guo', 'Chongyi Li', 'Jichang Guo', 'Chen Change Loy', 'Junhui Hou', 'Sam Kwong', 'Runmin Cong']",CoRR,2020
258,i,"Real or Not Real, that is the Question.","['Yuanbo Xiangli', 'Yubin Deng', 'Bo Dai', 'Chen Change Loy', 'Dahua Lin']",CoRR,2020
259,i,Residual Knowledge Distillation.,"['Mengya Gao', 'Yujun Shen', 'Quanquan Li', 'Chen Change Loy']",CoRR,2020
260,i,1st Place Solutions for OpenImage2019 - Object Detection and Instance Segmentation.,"['Yu Liu', 'Guanglu Song', 'Yuhang Zang', 'Yan Gao', 'Enze Xie', 'Junjie Yan', 'Chen Change Loy', 'Xiaogang Wang']",CoRR,2020
261,i,Exploiting Deep Generative Prior for Versatile Image Restoration and Manipulation.,"['Xingang Pan', 'Xiaohang Zhan', 'Bo Dai', 'Dahua Lin', 'Chen Change Loy', 'Ping Luo']",CoRR,2020
262,i,TransMoMo: Invariance-Driven Unsupervised Video Motion Retargeting.,"['Zhuoqian Yang', 'Wentao Zhu', 'Wayne Wu', 'Chen Qian', 'Qiang Zhou', 'Bolei Zhou', 'Chen Change Loy']",CoRR,2020
263,i,Learning to Cluster Faces via Confidence and Connectivity Estimation.,"['Lei Yang', 'Dapeng Chen', 'Xiaohang Zhan', 'Rui Zhao', 'Chen Change Loy', 'Dahua Lin']",CoRR,2020
264,i,Self-Supervised Scene De-occlusion.,"['Xiaohang Zhan', 'Xingang Pan', 'Bo Dai', 'Ziwei Liu', 'Dahua Lin', 'Chen Change Loy']",CoRR,2020
265,i,Feature Pyramid Grids.,"['Kai Chen', 'Yuhang Cao', 'Chen Change Loy', 'Dahua Lin', 'Christoph Feichtenhofer']",CoRR,2020
266,i,Inter-Region Affinity Distillation for Road Marking Segmentation.,"['Yuenan Hou', 'Zheng Ma', 'Chunxiao Liu', 'Tak-Wai Hui', 'Chen Change Loy']",CoRR,2020
267,i,Knowledge Distillation Meets Self-Supervision.,"['Guodong Xu', 'Ziwei Liu', 'Xiaoxiao Li', 'Chen Change Loy']",CoRR,2020
268,i,Online Deep Clustering for Unsupervised Representation Learning.,"['Xiaohang Zhan', 'Jiahao Xie', 'Ziwei Liu', 'Yew-Soon Ong', 'Chen Change Loy']",CoRR,2020
269,i,Cross-Scale Internal Graph Neural Network for Image Super-Resolution.,"['Shangchen Zhou', 'Jiawei Zhang', 'Wangmeng Zuo', 'Chen Change Loy']",CoRR,2020
270,i,RGB-D Salient Object Detection with Cross-Modality Modulation and Selection.,"['Chongyi Li', 'Runmin Cong', 'Yongri Piao', 'Qianqian Xu', 'Chen Change Loy']",CoRR,2020
271,i,LiteFlowNet3: Resolving Correspondence Ambiguity for More Accurate Optical Flow Estimation.,"['Tak-Wai Hui', 'Chen Change Loy']",CoRR,2020
272,i,TSIT: A Simple and Versatile Framework for Image-to-Image Translation.,"['Liming Jiang', 'Changxu Zhang', 'Mingyang Huang', 'Chunxiao Liu', 'Jianping Shi', 'Chen Change Loy']",CoRR,2020
273,i,MessyTable: Instance Association in Multiple Camera Views.,"['Zhongang Cai', 'Junzhe Zhang', 'Daxuan Ren', 'Cunjun Yu', 'Haiyu Zhao', 'Shuai Yi', 'Chai Kiat Yeo', 'Chen Change Loy']",CoRR,2020
274,i,Seesaw Loss for Long-Tailed Instance Segmentation.,"['Jiaqi Wang', 'Wenwei Zhang', 'Yuhang Zang', 'Yuhang Cao', 'Jiangmiao Pang', 'Tao Gong', 'Kai Chen', 'Ziwei Liu', 'Chen Change Loy', 'Dahua Lin']",CoRR,2020
275,i,Delving into Inter-Image Invariance for Unsupervised Visual Representations.,"['Jiahao Xie', 'Xiaohang Zhan', 'Ziwei Liu', 'Yew-Soon Ong', 'Chen Change Loy']",CoRR,2020
276,i,Understanding Deformable Alignment in Video Super-Resolution.,"['Kelvin C. K. Chan', 'Xintao Wang', 'Ke Yu', 'Chao Dong', 'Chen Change Loy']",CoRR,2020
277,i,Texture Memory-Augmented Deep Patch-Based Image Inpainting.,"['Rui Xu', 'Minghao Guo', 'Jiaqi Wang', 'Xiaoxiao Li', 'Bolei Zhou', 'Chen Change Loy']",CoRR,2020
278,i,Flexible Piecewise Curves Estimation for Photo Enhancement.,"['Chongyi Li', 'Chunle Guo', 'Qiming Ai', 'Shangchen Zhou', 'Chen Change Loy']",CoRR,2020
279,i,Do 2D GANs Know 3D Shape? Unsupervised 3D shape reconstruction from 2D Image GANs.,"['Xingang Pan', 'Bo Dai', 'Ziwei Liu', 'Chen Change Loy', 'Ping Luo']",CoRR,2020
280,i,GLEAN: Generative Latent Bank for Large-Factor Image Super-Resolution.,"['Kelvin C. K. Chan', 'Xintao Wang', 'Xiangyu Xu', 'Jinwei Gu', 'Chen Change Loy']",CoRR,2020
281,i,BasicVSR: The Search for Essential Components in Video Super-Resolution and Beyond.,"['Kelvin C. K. Chan', 'Xintao Wang', 'Ke Yu', 'Chao Dong', 'Chen Change Loy']",CoRR,2020
282,i,CARAFE++: Unified Content-Aware ReAssembly of FEatures.,"['Jiaqi Wang', 'Kai Chen', 'Rui Xu', 'Ziwei Liu', 'Chen Change Loy', 'Dahua Lin']",CoRR,2020
283,i,Positional Encoding as Spatial Inductive Bias in GANs.,"['Rui Xu', 'Xintao Wang', 'Kai Chen', 'Bolei Zhou', 'Chen Change Loy']",CoRR,2020
284,i,Computation-Efficient Knowledge Distillation via Uncertainty-Aware Mixup.,"['Guodong Xu', 'Ziwei Liu', 'Chen Change Loy']",CoRR,2020
285,i,Multi-Modality Cut and Paste for 3D Object Detection.,"['Wenwei Zhang', 'Zhe Wang', 'Chen Change Loy']",CoRR,2020
286,i,Focal Frequency Loss for Generative Models.,"['Liming Jiang', 'Bo Dai', 'Wayne Wu', 'Chen Change Loy']",CoRR,2020
287,i,Chasing the Tail in Monocular 3D Human Reconstruction with Prototype Memory.,"['Yu Rong', 'Ziwei Liu', 'Chen Change Loy']",CoRR,2020
288,i,Region Proposal by Guided Anchoring.,"['Jiaqi Wang', 'Kai Chen', 'Shuo Yang', 'Chen Change Loy', 'Dahua Lin']",CoRR,2019
289,i,Hybrid Task Cascade for Instance Segmentation.,"['Kai Chen', 'Jiangmiao Pang', 'Jiaqi Wang', 'Yu Xiong', 'Xiaoxiao Li', 'Shuyang Sun', 'Wansen Feng', 'Ziwei Liu', 'Jianping Shi', 'Wanli Ouyang', 'Chen Change Loy', 'Dahua Lin']",CoRR,2019
