,type,name,author,event,year
0,j,Learning to Prompt for Vision-Language Models.,"['Kaiyang Zhou', 'Jingkang Yang', 'Chen Change Loy', 'Ziwei Liu']",Int. J. Comput. Vis.,2022
1,j,Learning to Enhance Low-Light Image via Zero-Reference Deep Curve Estimation.,"['Chongyi Li', 'Chunle Guo', 'Chen Change Loy']",IEEE Trans. Pattern Anal. Mach. Intell.,2022
2,j,CARAFE++: Unified Content-Aware ReAssembly of FEatures.,"['Jiaqi Wang', 'Kai Chen', 'Rui Xu', 'Ziwei Liu', 'Chen Change Loy', 'Dahua Lin']",IEEE Trans. Pattern Anal. Mach. Intell.,2022
3,j,Path-Restore: Learning Network Path Selection for Image Restoration.,"['Ke Yu', 'Xintao Wang', 'Chao Dong', 'Xiaoou Tang', 'Chen Change Loy']",IEEE Trans. Pattern Anal. Mach. Intell.,2022
4,j,Exploiting Deep Generative Prior for Versatile Image Restoration and Manipulation.,"['Xingang Pan', 'Xiaohang Zhan', 'Bo Dai', 'Dahua Lin', 'Chen Change Loy', 'Ping Luo']",IEEE Trans. Pattern Anal. Mach. Intell.,2022
5,j,"Self-Supervised Representation Learning: Introduction, advances, and challenges.","['Linus Ericsson', 'Henry Gouk', 'Chen Change Loy', 'Timothy M. Hospedales']",IEEE Signal Process. Mag.,2022
6,j,Everybody's Talkin': Let Me Talk as You Want.,"['Linsen Song', 'Wayne Wu', 'Chen Qian', 'Ran He', 'Chen Change Loy']",IEEE Trans. Inf. Forensics Secur.,2022
7,j,Chasing the Tail in Monocular 3D Human Reconstruction With Prototype Memory.,"['Yu Rong', 'Ziwei Liu', 'Chen Change Loy']",IEEE Trans. Image Process.,2022
8,j,Text2Human: text-driven controllable human image generation.,"['Yuming Jiang', 'Shuai Yang', 'Haonan Qju', 'Wayne Wu', 'Chen Change Loy', 'Ziwei Liu']",ACM Trans. Graph.,2022
9,j,A Lightweight Optical Flow CNN - Revisiting Data Fidelity and Regularization.,"['Tak-Wai Hui', 'Xiaoou Tang', 'Chen Change Loy']",IEEE Trans. Pattern Anal. Mach. Intell.,2021
10,j,Texture Memory-Augmented Deep Patch-Based Image Inpainting.,"['Rui Xu', 'Minghao Guo', 'Jiaqi Wang', 'Xiaoxiao Li', 'Bolei Zhou', 'Chen Change Loy']",IEEE Trans. Image Process.,2021
11,j,High-Quality Video Generation from Static Structural Annotations.,"['Lu Sheng', 'Junting Pan', 'Jiaming Guo', 'Jing Shao', 'Chen Change Loy']",Int. J. Comput. Vis.,2020
12,j,Deep Imbalanced Learning for Face Recognition and Attribute Prediction.,"['Chen Huang', 'Yining Li', 'Chen Change Loy', 'Xiaoou Tang']",IEEE Trans. Pattern Anal. Mach. Intell.,2020
13,j,Editorial: Special Issue on Deep Learning for Face Analysis.,"['Chen Change Loy', 'Xiaoming Liu', 'Tae-Kyun Kim', 'Fernando De la Torre', 'Rama Chellappa']",Int. J. Comput. Vis.,2019
14,j,From Facial Expression Recognition to Interpersonal Relation Prediction.,"['Zhanpeng Zhang', 'Ping Luo', 'Chen Change Loy', 'Xiaoou Tang']",Int. J. Comput. Vis.,2018
15,j,Deep Learning Markov Random Field for Semantic Segmentation.,"['Ziwei Liu', 'Xiaoxiao Li', 'Ping Luo', 'Chen Change Loy', 'Xiaoou Tang']",IEEE Trans. Pattern Anal. Mach. Intell.,2018
16,j,Faceness-Net: Face Detection through Deep Facial Part Responses.,"['Shuo Yang', 'Ping Luo', 'Chen Change Loy', 'Xiaoou Tang']",IEEE Trans. Pattern Anal. Mach. Intell.,2018
17,j,Robust and Fast Decoding of High-Capacity Color QR Codes for Mobile Applications.,"['Zhibo Yang', 'Huanle Xu', 'Jianyuan Deng', 'Chen Change Loy', 'Wing Cheong Lau']",IEEE Trans. Image Process.,2018
18,j,Discriminative Sparse Neighbor Approximation for Imbalanced Learning.,"['Chen Huang', 'Chen Change Loy', 'Xiaoou Tang']",IEEE Trans. Neural Networks Learn. Syst.,2018
19,j,Image and Video Understanding in Big Data.,"['Vittorio Murino', 'Shaogang Gong', 'Chen Change Loy', 'Loris Bazzani']",Comput. Vis. Image Underst.,2017
20,j,Development of fine-grained pill identification algorithm using deep convolutional network.,"['Yuen Fei Wong', 'Hoi Ting Ng', 'Kit Yee Leung', 'Ka Yan Chan', 'Sau Yi Chan', 'Chen Change Loy']",J. Biomed. Informatics,2017
21,j,DeepID-Net: Object Detection with Deformable Part Based Convolutional Neural Networks.,"['Wanli Ouyang', 'Xingyu Zeng', 'Xiaogang Wang', 'Shi Qiu', 'Ping Luo', 'Yonglong Tian', 'Hongsheng Li', 'Shuo Yang', 'Zhe Wang', 'Hongyang Li', 'Kun Wang', 'Junjie Yan', 'Chen Change Loy', 'Xiaoou Tang']",IEEE Trans. Pattern Anal. Mach. Intell.,2017
22,j,Image Aesthetic Assessment: An experimental survey.,"['Yubin Deng', 'Chen Change Loy', 'Xiaoou Tang']",IEEE Signal Process. Mag.,2017
23,j,Crowded Scene Understanding by Deeply Learned Volumetric Slices.,"['Jing Shao', 'Chen Change Loy', 'Kai Kang', 'Xiaogang Wang']",IEEE Trans. Circuits Syst. Video Technol.,2017
24,j,Learning Scene-Independent Group Descriptors for Crowd Understanding.,"['Jing Shao', 'Chen Change Loy', 'Xiaogang Wang']",IEEE Trans. Circuits Syst. Video Technol.,2017
25,j,Learning from Multiple Sources for Video Summarisation.,"['Xiatian Zhu', 'Chen Change Loy', 'Shaogang Gong']",Int. J. Comput. Vis.,2016
26,j,"A survey on heterogeneous face recognition: Sketch, infra-red, 3D and low-resolution.","['Shuxin Ouyang', 'Timothy M. Hospedales', 'Yi-Zhe Song', 'Xueming Li', 'Chen Change Loy', 'Xiaogang Wang']",Image Vis. Comput.,2016
27,j,Image Super-Resolution Using Deep Convolutional Networks.,"['Chao Dong', 'Chen Change Loy', 'Kaiming He', 'Xiaoou Tang']",IEEE Trans. Pattern Anal. Mach. Intell.,2016
28,j,Learning Deep Representation for Face Alignment with Auxiliary Attributes.,"['Zhanpeng Zhang', 'Ping Luo', 'Chen Change Loy', 'Xiaoou Tang']",IEEE Trans. Pattern Anal. Mach. Intell.,2016
29,j,Constrained Clustering With Imperfect Oracles.,"['Xiatian Zhu', 'Chen Change Loy', 'Shaogang Gong']",IEEE Trans. Neural Networks Learn. Syst.,2016
30,j,On-the-fly feature importance mining for person re-identification.,"['Chunxiao Liu', 'Shaogang Gong', 'Chen Change Loy']",Pattern Recognit.,2014
31,j,Incremental Activity Modeling in Multiple Disjoint Cameras.,"['Chen Change Loy', 'Tao Xiang', 'Shaogang Gong']",IEEE Trans. Pattern Anal. Mach. Intell.,2012
32,j,Detecting and discriminating behavioural anomalies.,"['Chen Change Loy', 'Tao Xiang', 'Shaogang Gong']",Pattern Recognit.,2011
33,j,Time-Delayed Correlation Analysis for Multi-Camera Activity Understanding.,"['Chen Change Loy', 'Tao Xiang', 'Shaogang Gong']",Int. J. Comput. Vis.,2010
34,c,MoCaNet: Motion Retargeting In-the-Wild via Canonicalization Networks.,"['Wentao Zhu', 'Zhuoqian Yang', 'Ziang Di', 'Wayne Wu', 'Yizhou Wang', 'Chen Change Loy']",AAAI,2022
35,c,Delving into High-Quality Synthetic Face Occlusion Segmentation Datasets.,"['Kenny T. R. Voo', 'Liming Jiang', 'Chen Change Loy']",CVPR Workshops,2022
36,c,Investigating Tradeoffs in Real-World Video Super-Resolution.,"['Kelvin C. K. Chan', 'Shangchen Zhou', 'Xiangyu Xu', 'Chen Change Loy']",CVPR,2022
37,c,BasicVSR++: Improving Video Super-Resolution with Enhanced Propagation and Alignment.,"['Kelvin C. K. Chan', 'Shangchen Zhou', 'Xiangyu Xu', 'Chen Change Loy']",CVPR,2022
38,c,TransEditor: Transformer-Based Dual-Space GAN for Highly Controllable Facial Editing.,"['Yanbo Xu', 'Yueqin Yin', 'Liming Jiang', 'Qianyi Wu', 'Chengyao Zheng', 'Chen Change Loy', 'Bo Dai', 'Wayne Wu']",CVPR,2022
39,c,Pastiche Master: Exemplar-Based High-Resolution Portrait Style Transfer.,"['Shuai Yang', 'Liming Jiang', 'Ziwei Liu', 'Chen Change Loy']",CVPR,2022
40,c,Point-to-Voxel Knowledge Distillation for LiDAR Semantic Segmentation.,"['Yuenan Hou', 'Xinge Zhu', 'Yuexin Ma', 'Chen Change Loy', 'Yikang Li']",CVPR,2022
41,c,Bailando: 3D Dance Generation by Actor-Critic GPT with Choreographic Memory.,"['Li Siyao', 'Weijiang Yu', 'Tianpei Gu', 'Chunze Lin', 'Quan Wang', 'Chen Qian', 'Chen Change Loy', 'Ziwei Liu']",CVPR,2022
42,c,Conditional Prompt Learning for Vision-Language Models.,"['Kaiyang Zhou', 'Jingkang Yang', 'Chen Change Loy', 'Ziwei Liu']",CVPR,2022
43,c,Unsupervised Image-to-Image Translation with Generative Prior.,"['Shuai Yang', 'Liming Jiang', 'Ziwei Liu', 'Chen Change Loy']",CVPR,2022
44,c,"Video K-Net: A Simple, Strong, and Unified Baseline for Video Segmentation.","['Xiangtai Li', 'Wenwei Zhang', 'Jiangmiao Pang', 'Kai Chen', 'Guangliang Cheng', 'Yunhai Tong', 'Chen Change Loy']",CVPR,2022
45,c,StyleGAN-Human: A Data-Centric Odyssey of Human Generation.,"['Jianglin Fu', 'Shikai Li', 'Yuming Jiang', 'Kwan-Yee Lin', 'Chen Qian', 'Chen Change Loy', 'Wayne Wu', 'Ziwei Liu']",ECCV (16),2022
46,c,Monocular 3D Object Reconstruction with GAN Inversion.,"['Junzhe Zhang', 'Daxuan Ren', 'Zhongang Cai', 'Chai Kiat Yeo', 'Bo Dai', 'Chen Change Loy']",ECCV (1),2022
47,c,Extract Free Dense Labels from CLIP.,"['Chong Zhou', 'Chen Change Loy', 'Bo Dai']",ECCV (28),2022
48,c,Monocular 3D Reconstruction of Interacting Hands via Collision-Aware Factorized Refinements.,"['Yu Rong', 'Jingbo Wang', 'Ziwei Liu', 'Chen Change Loy']",3DV,2021
49,c,Understanding Deformable Alignment in Video Super-Resolution.,"['Kelvin C. K. Chan', 'Xintao Wang', 'Ke Yu', 'Chao Dong', 'Chen Change Loy']",AAAI,2021
50,c,Removing Diffraction Image Artifacts in Under-Display Camera via Dynamic Skip Connection Network.,"['Ruicheng Feng', 'Chongyi Li', 'Huaijin Chen', 'Shuai Li', 'Chen Change Loy', 'Jinwei Gu']",CVPR,2021
51,c,Unsupervised 3D Shape Completion Through GAN Inversion.,"['Junzhe Zhang', 'Xinyi Chen', 'Zhongang Cai', 'Liang Pan', 'Haiyu Zhao', 'Shuai Yi', 'Chai Kiat Yeo', 'Bo Dai', 'Chen Change Loy']",CVPR,2021
52,c,Robust Reference-Based Super-Resolution via C2-Matching.,"['Yuming Jiang', 'Kelvin C. K. Chan', 'Xintao Wang', 'Chen Change Loy', 'Ziwei Liu']",CVPR,2021
53,c,Pareidolia Face Reenactment.,"['Linsen Song', 'Wayne Wu', 'Chaoyou Fu', 'Chen Qian', 'Chen Change Loy', 'Ran He']",CVPR,2021
54,c,Pose-Controllable Talking Face Generation by Implicitly Modularized Audio-Visual Representation.,"['Hang Zhou', 'Yasheng Sun', 'Wayne Wu', 'Chen Change Loy', 'Xiaogang Wang', 'Ziwei Liu']",CVPR,2021
55,c,BasicVSR: The Search for Essential Components in Video Super-Resolution and Beyond.,"['Kelvin C. K. Chan', 'Xintao Wang', 'Ke Yu', 'Chao Dong', 'Chen Change Loy']",CVPR,2021
56,c,Deep Animation Video Interpolation in the Wild.,"['Siyao Li', 'Shiyu Zhao', 'Weijiang Yu', 'Wenxiu Sun', 'Dimitris N. Metaxas', 'Chen Change Loy', 'Ziwei Liu']",CVPR,2021
57,c,Seesaw Loss for Long-Tailed Instance Segmentation.,"['Jiaqi Wang', 'Wenwei Zhang', 'Yuhang Zang', 'Yuhang Cao', 'Jiangmiao Pang', 'Tao Gong', 'Kai Chen', 'Ziwei Liu', 'Chen Change Loy', 'Dahua Lin']",CVPR,2021
58,c,Positional Encoding As Spatial Inductive Bias in GANs.,"['Rui Xu', 'Xintao Wang', 'Kai Chen', 'Bolei Zhou', 'Chen Change Loy']",CVPR,2021
59,c,Audio-Driven Emotional Video Portraits.,"['Xinya Ji', 'Hang Zhou', 'Kaisiyuan Wang', 'Wayne Wu', 'Chen Change Loy', 'Xun Cao', 'Feng Xu']",CVPR,2021
60,c,GLEAN: Generative Latent Bank for Large-Factor Image Super-Resolution.,"['Kelvin C. K. Chan', 'Xintao Wang', 'Xiangyu Xu', 'Jinwei Gu', 'Chen Change Loy']",CVPR,2021
61,c,FASA: Feature Augmentation and Sampling Adaptation for Long-Tailed Instance Segmentation.,"['Yuhang Zang', 'Chen Huang', 'Chen Change Loy']",ICCV,2021
62,c,ReconfigISP: Reconfigurable Camera Image Processing Pipeline.,"['Ke Yu', 'Zexian Li', 'Yue Peng', 'Chen Change Loy', 'Jinwei Gu']",ICCV,2021
63,c,Talk-to-Edit: Fine-Grained Facial Editing via Dialog.,"['Yuming Jiang', 'Ziqi Huang', 'Xingang Pan', 'Chen Change Loy', 'Ziwei Liu']",ICCV,2021
64,c,3D Human Texture Estimation from a Single Image with Transformers.,"['Xiangyu Xu', 'Chen Change Loy']",ICCV,2021
65,c,Focal Frequency Loss for Image Reconstruction and Synthesis.,"['Liming Jiang', 'Bo Dai', 'Wayne Wu', 'Chen Change Loy']",ICCV,2021
66,c,Do 2D GANs Know 3D Shape? Unsupervised 3D Shape Reconstruction from 2D Image GANs.,"['Xingang Pan', 'Bo Dai', 'Ziwei Liu', 'Chen Change Loy', 'Ping Luo']",ICLR,2021
67,c,Retrospective Class Incremental Learning.,"['Qingyi Tao', 'Chen Change Loy', 'Jianfei Cai', 'ZongYuan Ge', 'Simon See']",ICME,2021
68,c,K-Net: Towards Unified Image Segmentation.,"['Wenwei Zhang', 'Jiangmiao Pang', 'Kai Chen', 'Chen Change Loy']",NeurIPS,2021
69,c,A Shading-Guided Generative Implicit Model for Shape-Accurate 3D-Aware Image Synthesis.,"['Xingang Pan', 'Xudong Xu', 'Chen Change Loy', 'Christian Theobalt', 'Bo Dai']",NeurIPS,2021
70,c,Deceive D: Adaptive Pseudo Augmentation for GAN Training with Limited Data.,"['Liming Jiang', 'Bo Dai', 'Wayne Wu', 'Chen Change Loy']",NeurIPS,2021
71,c,Unsupervised Object-Level Representation Learning from Scene Images.,"['Jiahao Xie', 'Xiaohang Zhan', 'Ziwei Liu', 'Yew Soon Ong', 'Chen Change Loy']",NeurIPS,2021
72,c,Zero-Reference Deep Curve Estimation for Low-Light Image Enhancement.,"['Chunle Guo', 'Chongyi Li', 'Jichang Guo', 'Chen Change Loy', 'Junhui Hou', 'Sam Kwong', 'Runmin Cong']",CVPR,2020
73,c,DeeperForensics-1.0: A Large-Scale Dataset for Real-World Face Forgery Detection.,"['Liming Jiang', 'Ren Li', 'Wayne Wu', 'Chen Qian', 'Chen Change Loy']",CVPR,2020
74,c,Self-Supervised Scene De-Occlusion.,"['Xiaohang Zhan', 'Xingang Pan', 'Bo Dai', 'Ziwei Liu', 'Dahua Lin', 'Chen Change Loy']",CVPR,2020
75,c,TransMoMo: Invariance-Driven Unsupervised Video Motion Retargeting.,"['Zhuoqian Yang', 'Wentao Zhu', 'Wayne Wu', 'Chen Qian', 'Qiang Zhou', 'Bolei Zhou', 'Chen Change Loy']",CVPR,2020
76,c,Online Deep Clustering for Unsupervised Representation Learning.,"['Xiaohang Zhan', 'Jiahao Xie', 'Ziwei Liu', 'Yew-Soon Ong', 'Chen Change Loy']",CVPR,2020
77,c,EcoNAS: Finding Proxies for Economical Neural Architecture Search.,"['Dongzhan Zhou', 'Xinchi Zhou', 'Wenwei Zhang', 'Chen Change Loy', 'Shuai Yi', 'Xuesen Zhang', 'Wanli Ouyang']",CVPR,2020
78,c,Prime Sample Attention in Object Detection.,"['Yuhang Cao', 'Kai Chen', 'Chen Change Loy', 'Dahua Lin']",CVPR,2020
79,c,Inter-Region Affinity Distillation for Road Marking Segmentation.,"['Yuenan Hou', 'Zheng Ma', 'Chunxiao Liu', 'Tak-Wai Hui', 'Chen Change Loy']",CVPR,2020
80,c,Learning to Cluster Faces via Confidence and Connectivity Estimation.,"['Lei Yang', 'Dapeng Chen', 'Xiaohang Zhan', 'Rui Zhao', 'Chen Change Loy', 'Dahua Lin']",CVPR,2020
81,c,MessyTable: Instance Association in Multiple Camera Views.,"['Zhongang Cai', 'Junzhe Zhang', 'Daxuan Ren', 'Cunjun Yu', 'Haiyu Zhao', 'Shuai Yi', 'Chai Kiat Yeo', 'Chen Change Loy']",ECCV (11),2020
82,c,LiteFlowNet3: Resolving Correspondence Ambiguity for More Accurate Optical Flow Estimation.,"['Tak-Wai Hui', 'Chen Change Loy']",ECCV (20),2020
83,c,TSIT: A Simple and Versatile Framework for Image-to-Image Translation.,"['Liming Jiang', 'Changxu Zhang', 'Mingyang Huang', 'Chunxiao Liu', 'Jianping Shi', 'Chen Change Loy']",ECCV (3),2020
84,c,RGB-D Salient Object Detection with Cross-Modality Modulation and Selection.,"['Chongyi Li', 'Runmin Cong', 'Yongri Piao', 'Qianqian Xu', 'Chen Change Loy']",ECCV (8),2020
85,c,Exploiting Deep Generative Prior for Versatile Image Restoration and Manipulation.,"['Xingang Pan', 'Xiaohang Zhan', 'Bo Dai', 'Dahua Lin', 'Chen Change Loy', 'Ping Luo']",ECCV (2),2020
86,c,Side-Aware Boundary Localization for More Precise Object Detection.,"['Jiaqi Wang', 'Wenwei Zhang', 'Yuhang Cao', 'Kai Chen', 'Jiangmiao Pang', 'Tao Gong', 'Jianping Shi', 'Chen Change Loy', 'Dahua Lin']",ECCV (4),2020
87,c,Knowledge Distillation Meets Self-supervision.,"['Guodong Xu', 'Ziwei Liu', 'Xiaoxiao Li', 'Chen Change Loy']",ECCV (9),2020
88,c,MEAD: A Large-Scale Audio-Visual Dataset for Emotional Talking-Face Generation.,"['Kaisiyuan Wang', 'Qianyi Wu', 'Linsen Song', 'Zhuoqian Yang', 'Wayne Wu', 'Chen Qian', 'Ran He', 'Yu Qiao', 'Chen Change Loy']",ECCV (21),2020
89,c,"Real or Not Real, that is the Question.","['Yuanbo Xiangli', 'Yubin Deng', 'Bo Dai', 'Chen Change Loy', 'Dahua Lin']",ICLR,2020
90,c,Cross-Scale Internal Graph Neural Network for Image Super-Resolution.,"['Shangchen Zhou', 'Jiawei Zhang', 'Wangmeng Zuo', 'Chen Change Loy']",NeurIPS,2020
91,c,Learning to Steer by Mimicking Features from Heterogeneous Auxiliary Networks.,"['Yuenan Hou', 'Zheng Ma', 'Chunxiao Liu', 'Chen Change Loy']",AAAI,2019
92,c,Instance-Level Facial Attributes Transfer with Geometry-Aware Flow.,"['Weidong Yin', 'Ziwei Liu', 'Chen Change Loy']",AAAI,2019
93,c,One-shot Face Reenactment.,"['Yunxuan Zhang', 'Siwei Zhang', 'Yue He', 'Cheng Li', 'Chen Change Loy', 'Ziwei Liu']",BMVC,2019
94,c,Learning a Unified Classifier Incrementally via Rebalancing.,"['Saihui Hou', 'Xinyu Pan', 'Chen Change Loy', 'Zilei Wang', 'Dahua Lin']",CVPR,2019
95,c,Deep Network Interpolation for Continuous Imagery Effect Transition.,"['Xintao Wang', 'Ke Yu', 'Chao Dong', 'Xiaoou Tang', 'Chen Change Loy']",CVPR,2019
96,c,Self-Supervised Learning via Conditional Motion Propagation.,"['Xiaohang Zhan', 'Xingang Pan', 'Ziwei Liu', 'Dahua Lin', 'Chen Change Loy']",CVPR,2019
97,c,EDVR: Video Restoration With Enhanced Deformable Convolutional Networks.,"['Xintao Wang', 'Kelvin C. K. Chan', 'Ke Yu', 'Chao Dong', 'Chen Change Loy']",CVPR Workshops,2019
98,c,NTIRE 2019 Challenge on Video Deblurring: Methods and Results.,"['Seungjun Nah', 'Radu Timofte', 'Sungyong Baik', 'Seokil Hong', 'Gyeongsik Moon', 'Sanghyun Son', 'Kyoung Mu Lee', 'Xintao Wang', 'Kelvin C. K. Chan', 'Ke Yu', 'Chao Dong', 'Chen Change Loy', 'Yuchen Fan', 'Jiahui Yu', 'Ding Liu', 'Thomas S. Huang', 'Hyeonjun Sim', 'Munchurl Kim', 'Dongwon Park', 'Jisoo Kim', 'Se Young Chun', 'Muhammad Haris', 'Greg Shakhnarovich', 'Norimichi Ukita', 'Syed Waqas Zamir', 'Aditya Arora', 'Salman H. Khan', 'Fahad Shahbaz Khan', 'Ling Shao', 'Rahul Kumar Gupta', 'Vishal M. Chudasama', 'Heena Patel', 'Kishor P. Upla', 'Hongfei Fan', 'Guo Li', 'Yumei Zhang', 'Xiang Li', 'Wenjie Zhang', 'Qingwen He', 'Kuldeep Purohit', 'A. N. Rajagopalan', 'Jeonghun Kim', 'Mohammad Tofighi', 'Tiantong Guo', 'Vishal Monga']",CVPR Workshops,2019
99,c,NTIRE 2019 Challenge on Video Super-Resolution: Methods and Results.,"['Seungjun Nah', 'Radu Timofte', 'Shuhang Gu', 'Sungyong Baik', 'Seokil Hong', 'Gyeongsik Moon', 'Sanghyun Son', 'Kyoung Mu Lee', 'Xintao Wang', 'Kelvin C. K. Chan', 'Ke Yu', 'Chao Dong', 'Chen Change Loy', 'Yuchen Fan', 'Jiahui Yu', 'Ding Liu', 'Thomas S. Huang', 'Xiao Liu', 'Chao Li', 'Dongliang He', 'Yukang Ding', 'Shilei Wen', 'Fatih Porikli', 'Ratheesh Kalarot', 'Muhammad Haris', 'Greg Shakhnarovich', 'Norimichi Ukita', 'Peng Yi', 'Zhongyuan Wang', 'Kui Jiang', 'Junjun Jiang', 'Jiayi Ma', 'Hang Dong', 'Xinyi Zhang', 'Zhe Hu', 'Kwan-Young Kim', 'Dong Un Kang', 'Se Young Chun', 'Kuldeep Purohit', 'A. N. Rajagopalan', 'Yapeng Tian', 'Yulun Zhang', 'Yun Fu', 'Chenliang Xu', 'A. Murat Tekalp', 'M. Akin Yilmaz', 'Cansu Korkmaz', 'Manoj Sharma', 'Megh Makwana', 'Anuj Badhwar', 'Ajay Pratap Singh', 'Avinash Upadhyay', 'Rudrabha Mukhopadhyay', 'Ankit Shukla', 'Dheeraj Khanna', 'A. S. Mandal', 'Santanu Chaudhury', 'Si Miao', 'Yongxin Zhu', 'Xiao Huo']",CVPR Workshops,2019
100,c,Learning to Cluster Faces on an Affinity Graph.,"['Lei Yang', 'Xiaohang Zhan', 'Dapeng Chen', 'Junjie Yan', 'Chen Change Loy', 'Dahua Lin']",CVPR,2019
101,c,Region Proposal by Guided Anchoring.,"['Jiaqi Wang', 'Kai Chen', 'Shuo Yang', 'Chen Change Loy', 'Dahua Lin']",CVPR,2019
102,c,Dense Intrinsic Appearance Flow for Human Pose Transfer.,"['Yining Li', 'Chen Huang', 'Chen Change Loy']",CVPR,2019
103,c,Deep Flow-Guided Video Inpainting.,"['Rui Xu', 'Xiaoxiao Li', 'Bolei Zhou', 'Chen Change Loy']",CVPR,2019
104,c,Hybrid Task Cascade for Instance Segmentation.,"['Kai Chen', 'Jiangmiao Pang', 'Jiaqi Wang', 'Yu Xiong', 'Xiaoxiao Li', 'Shuyang Sun', 'Wansen Feng', 'Ziwei Liu', 'Jianping Shi', 'Wanli Ouyang', 'Chen Change Loy', 'Dahua Lin']",CVPR,2019
105,c,TransGaGa: Geometry-Aware Unsupervised Image-To-Image Translation.,"['Wayne Wu', 'Kaidi Cao', 'Cheng Li', 'Chen Qian', 'Chen Change Loy']",CVPR,2019
106,c,Learning Lightweight Lane Detection CNNs by Self Attention Distillation.,"['Yuenan Hou', 'Zheng Ma', 'Chunxiao Liu', 'Chen Change Loy']",ICCV,2019
107,c,Robust Multi-Modality Multi-Object Tracking.,"['Wenwei Zhang', 'Hui Zhou', 'Shuyang Sun', 'Zhe Wang', 'Jianping Shi', 'Chen Change Loy']",ICCV,2019
108,c,CARAFE: Content-Aware ReAssembly of FEatures.,"['Jiaqi Wang', 'Kai Chen', 'Rui Xu', 'Ziwei Liu', 'Chen Change Loy', 'Dahua Lin']",ICCV,2019
109,c,Delving Deep Into Hybrid Annotations for 3D Human Recovery in the Wild.,"['Yu Rong', 'Ziwei Liu', 'Cheng Li', 'Kaidi Cao', 'Chen Change Loy']",ICCV,2019
110,c,Disentangling Content and Style via Unsupervised Geometry Distillation.,"['Wayne Wu', 'Kaidi Cao', 'Cheng Li', 'Chen Qian', 'Chen Change Loy']",DGS@ICLR,2019
111,c,Merge or Not? Learning to Group Faces via Imitation Learning.,"['Yue He', 'Kaidi Cao', 'Cheng Li', 'Chen Change Loy']",AAAI,2018
112,c,Mix-and-Match Tuning for Self-Supervised Semantic Segmentation.,"['Xiaohang Zhan', 'Ziwei Liu', 'Ping Luo', 'Xiaoou Tang', 'Chen Change Loy']",AAAI,2018
113,c,Recovering Realistic Texture in Image Super-Resolution by Deep Spatial Feature Transform.,"['Xintao Wang', 'Ke Yu', 'Chao Dong', 'Chen Change Loy']",CVPR,2018
114,c,Crafting a Toolchain for Image Restoration by Deep Reinforcement Learning.,"['Ke Yu', 'Chao Dong', 'Liang Lin', 'Chen Change Loy']",CVPR,2018
115,c,Pose-Robust Face Recognition via Deep Residual Equivariant Mapping.,"['Kaidi Cao', 'Yu Rong', 'Cheng Li', 'Xiaoou Tang', 'Chen Change Loy']",CVPR,2018
116,c,Optimizing Video Object Detection via a Scale-Time Lattice.,"['Kai Chen', 'Jiaqi Wang', 'Shuo Yang', 'Xingcheng Zhang', 'Yuanjun Xiong', 'Chen Change Loy', 'Dahua Lin']",CVPR,2018
117,c,LiteFlowNet: A Lightweight Convolutional Neural Network for Optical Flow Estimation.,"['Tak-Wai Hui', 'Xiaoou Tang', 'Chen Change Loy']",CVPR,2018
118,c,ESRGAN: Enhanced Super-Resolution Generative Adversarial Networks.,"['Xintao Wang', 'Ke Yu', 'Shixiang Wu', 'Jinjin Gu', 'Yihao Liu', 'Chao Dong', 'Yu Qiao', 'Chen Change Loy']",ECCV Workshops (5),2018
119,c,Video Object Segmentation with Joint Re-identification and Attention-Aware Mask Propagation.,"['Xiaoxiao Li', 'Chen Change Loy']",ECCV (3),2018
120,c,PSANet: Point-wise Spatial Attention Network for Scene Parsing.,"['Hengshuang Zhao', 'Yi Zhang', 'Shu Liu', 'Jianping Shi', 'Chen Change Loy', 'Dahua Lin', 'Jiaya Jia']",ECCV (9),2018
121,c,Zoom-Net: Mining Deep Feature Interactions for Visual Relationship Recognition.,"['Guojun Yin', 'Lu Sheng', 'Bin Liu', 'Nenghai Yu', 'Xiaogang Wang', 'Jing Shao', 'Chen Change Loy']",ECCV (3),2018
122,c,Lifelong Learning via Progressive Distillation and Retrospection.,"['Saihui Hou', 'Xinyu Pan', 'Chen Change Loy', 'Zilei Wang', 'Dahua Lin']",ECCV (3),2018
123,c,Consensus-Driven Propagation in Massive Unlabeled Data for Face Recognition.,"['Xiaohang Zhan', 'Ziwei Liu', 'Junjie Yan', 'Dahua Lin', 'Chen Change Loy']",ECCV (9),2018
124,c,ReenactGAN: Learning to Reenact Faces via Boundary Transfer.,"['Wayne Wu', 'Yunxuan Zhang', 'Cheng Li', 'Chen Qian', 'Chen Change Loy']",ECCV (1),2018
125,c,The Devil of Face Recognition Is in the Noise.,"['Fei Wang', 'Liren Chen', 'Cheng Li', 'Shiyao Huang', 'Yanjie Chen', 'Chen Qian', 'Chen Change Loy']",ECCV (9),2018
126,c,Fusing Object Context to Detect Functional Area for Cognitive Robots.,"['Hui Cheng', 'Junhao Cai', 'Quande Liu', 'Zhanpeng Zhang', 'Kai Yang', 'Chen Change Loy', 'Liang Lin']",ICRA,2018
127,c,Aesthetic-Driven Image Enhancement by Adversarial Learning.,"['Yubin Deng', 'Chen Change Loy', 'Xiaoou Tang']",ACM Multimedia,2018
128,c,Non-Local Recurrent Network for Image Restoration.,"['Ding Liu', 'Bihan Wen', 'Yuchen Fan', 'Chen Change Loy', 'Thomas S. Huang']",NeurIPS,2018
129,c,Quantifying Facial Age by Posterior of Age Comparisons.,"['Yunxuan Zhang', 'Li Liu', 'Cheng Li', 'Chen Change Loy']",BMVC,2017
130,c,NTIRE 2017 Challenge on Single Image Super-Resolution: Methods and Results.,"['Radu Timofte', 'Eirikur Agustsson', 'Luc Van Gool', 'Ming-Hsuan Yang', 'Lei Zhang', 'Bee Lim', 'Sanghyun Son', 'Heewon Kim', 'Seungjun Nah', 'Kyoung Mu Lee', 'Xintao Wang', 'Yapeng Tian', 'Ke Yu', 'Yulun Zhang', 'Shixiang Wu', 'Chao Dong', 'Liang Lin', 'Yu Qiao', 'Chen Change Loy', 'Woong Bae', 'Jae Jun Yoo', 'Yoseob Han', 'Jong Chul Ye', 'Jae-Seok Choi', 'Munchurl Kim', 'Yuchen Fan', 'Jiahui Yu', 'Wei Han', 'Ding Liu', 'Haichao Yu', 'Zhangyang Wang', 'Honghui Shi', 'Xinchao Wang', 'Thomas S. Huang', 'Yunjin Chen', 'Kai Zhang', 'Wangmeng Zuo', 'Zhimin Tang', 'Linkai Luo', 'Shaohui Li', 'Min Fu', 'Lei Cao', 'Wen Heng', 'Giang Bui', 'Truc Le', 'Ye Duan', 'Dacheng Tao', 'Ruxin Wang', 'Xu Lin', 'Jianxin Pang', 'Jinchang Xu', 'Yu Zhao', 'Xiangyu Xu', 'Jin-shan Pan', 'Deqing Sun', 'Yujin Zhang', 'Xibin Song', 'Yuchao Dai', 'Xueying Qin', 'Xuan-Phung Huynh', 'Tiantong Guo', 'Hojjat Seyed Mousavi', 'Tiep Huu Vu', 'Vishal Monga', 'Cristóvão Cruz', 'Karen O. Egiazarian', 'Vladimir Katkovnik', 'Rakesh Mehta', 'Arnav Kumar Jain', 'Abhinav Agarwalla', 'Ch V. Sai Praveen', 'Ruofan Zhou', 'Hongdiao Wen', 'Che Zhu', 'Zhiqiang Xia', 'Zhengtao Wang', 'Qi Guo']",CVPR Workshops,2017
131,c,Discover and Learn New Objects from Documentaries.,"['Kai Chen', 'Hang Song', 'Chen Change Loy', 'Dahua Lin']",CVPR,2017
132,c,PolyNet: A Pursuit of Structural Diversity in Very Deep Networks.,"['Xingcheng Zhang', 'Zhizhong Li', 'Chen Change Loy', 'Dahua Lin']",CVPR,2017
133,c,Not All Pixels Are Equal: Difficulty-Aware Semantic Segmentation via Deep Layer Cascade.,"['Xiaoxiao Li', 'Ziwei Liu', 'Ping Luo', 'Chen Change Loy', 'Xiaoou Tang']",CVPR,2017
134,c,Be Your Own Prada: Fashion Synthesis with Structural Coherence.,"['Shizhan Zhu', 'Sanja Fidler', 'Raquel Urtasun', 'Dahua Lin', 'Chen Change Loy']",ICCV,2017
135,c,Learning to Disambiguate by Asking Discriminative Questions.,"['Yining Li', 'Chen Huang', 'Xiaoou Tang', 'Chen Change Loy']",ICCV,2017
136,c,Reading Scene Text in Deep Convolutional Sequences.,"['Pan He', 'Weilin Huang', 'Yu Qiao', 'Chen Change Loy', 'Xiaoou Tang']",AAAI,2016
137,c,Pedestrian Color Naming via Convolutional Neural Network.,"['Zhiyi Cheng', 'Xiaoxiao Li', 'Chen Change Loy']",ACCV (2),2016
138,c,Sketch Me That Shoe.,"['Qian Yu', 'Feng Liu', 'Yi-Zhe Song', 'Tao Xiang', 'Timothy M. Hospedales', 'Chen Change Loy']",CVPR,2016
