,type,name,author,event,year
290,i,WIDER Face and Pedestrian Challenge 2018: Methods and Results.,"['Chen Change Loy', 'Dahua Lin', 'Wanli Ouyang', 'Yuanjun Xiong', 'Shuo Yang', 'Qingqiu Huang', 'Dongzhan Zhou', 'Wei Xia', 'Quanquan Li', 'Ping Luo', 'Junjie Yan', 'Jianfeng Wang', 'Zuoxin Li', 'Ye Yuan', 'Boxun Li', 'Shuai Shao', 'Gang Yu', 'Fangyun Wei', 'Xiang Ming', 'Dong Chen', 'Shifeng Zhang', 'Cheng Chi', 'Zhen Lei', 'Stan Z. Li', 'Hongkai Zhang', 'Bingpeng Ma', 'Hong Chang', 'Shiguang Shan', 'Xilin Chen', 'Wu Liu', 'Boyan Zhou', 'Huaxiong Li', 'Peng Cheng', 'Tao Mei', 'Artem Kukharenko', 'Artem Vasenin', 'Nikolay Sergievskiy', 'Hua Yang', 'Liangqi Li', 'Qiling Xu', 'Yuan Hong', 'Lin Chen', 'Mingjun Sun', 'Yirong Mao', 'Shiying Luo', 'Yongjun Li', 'Ruiping Wang', 'Qiaokang Xie', 'Ziyang Wu', 'Lei Lu', 'Yiheng Liu', 'Wengang Zhou']",CoRR,2019
291,i,Unsupervised Bi-directional Flow-based Video Generation from one Snapshot.,"['Lu Sheng', 'Junting Pan', 'Jiaming Guo', 'Jing Shao', 'Xiaogang Wang', 'Chen Change Loy']",CoRR,2019
292,i,A Lightweight Optical Flow CNN - Revisiting Data Fidelity and Regularization.,"['Tak-Wai Hui', 'Xiaoou Tang', 'Chen Change Loy']",CoRR,2019
293,i,Dense Intrinsic Appearance Flow for Human Pose Transfer.,"['Yining Li', 'Chen Huang', 'Chen Change Loy']",CoRR,2019
294,i,Self-Supervised Learning via Conditional Motion Propagation.,"['Xiaohang Zhan', 'Xingang Pan', 'Ziwei Liu', 'Dahua Lin', 'Chen Change Loy']",CoRR,2019
295,i,Learning to Cluster Faces on an Affinity Graph.,"['Lei Yang', 'Xiaohang Zhan', 'Dapeng Chen', 'Junjie Yan', 'Chen Change Loy', 'Dahua Lin']",CoRR,2019
296,i,Prime Sample Attention in Object Detection.,"['Yuhang Cao', 'Kai Chen', 'Chen Change Loy', 'Dahua Lin']",CoRR,2019
297,i,TransGaGa: Geometry-Aware Unsupervised Image-to-Image Translation.,"['Wayne Wu', 'Kaidi Cao', 'Cheng Li', 'Chen Qian', 'Chen Change Loy']",CoRR,2019
298,i,Path-Restore: Learning Network Path Selection for Image Restoration.,"['Ke Yu', 'Xintao Wang', 'Chao Dong', 'Xiaoou Tang', 'Chen Change Loy']",CoRR,2019
299,i,CARAFE: Content-Aware ReAssembly of FEatures.,"['Jiaqi Wang', 'Kai Chen', 'Rui Xu', 'Ziwei Liu', 'Chen Change Loy', 'Dahua Lin']",CoRR,2019
300,i,EDVR: Video Restoration with Enhanced Deformable Convolutional Networks.,"['Xintao Wang', 'Kelvin C. K. Chan', 'Ke Yu', 'Chao Dong', 'Chen Change Loy']",CoRR,2019
301,i,Deep Flow-Guided Video Inpainting.,"['Rui Xu', 'Xiaoxiao Li', 'Bolei Zhou', 'Chen Change Loy']",CoRR,2019
302,i,Disentangling Content and Style via Unsupervised Geometry Distillation.,"['Wayne Wu', 'Kaidi Cao', 'Cheng Li', 'Chen Qian', 'Chen Change Loy']",CoRR,2019
303,i,MMDetection: Open MMLab Detection Toolbox and Benchmark.,"['Kai Chen', 'Jiaqi Wang', 'Jiangmiao Pang', 'Yuhang Cao', 'Yu Xiong', 'Xiaoxiao Li', 'Shuyang Sun', 'Wansen Feng', 'Ziwei Liu', 'Jiarui Xu', 'Zheng Zhang', 'Dazhi Cheng', 'Chenchen Zhu', 'Tianheng Cheng', 'Qijie Zhao', 'Buyu Li', 'Xin Lu', 'Rui Zhu', 'Yue Wu', 'Jifeng Dai', 'Jingdong Wang', 'Jianping Shi', 'Wanli Ouyang', 'Chen Change Loy', 'Dahua Lin']",CoRR,2019
304,i,Learning Lightweight Lane Detection CNNs by Self Attention Distillation.,"['Yuenan Hou', 'Zheng Ma', 'Chunxiao Liu', 'Chen Change Loy']",CoRR,2019
305,i,One-shot Face Reenactment.,"['Yunxuan Zhang', 'Siwei Zhang', 'Yue He', 'Cheng Li', 'Chen Change Loy', 'Ziwei Liu']",CoRR,2019
306,i,Delving Deep Into Hybrid Annotations for 3D Human Recovery in the Wild.,"['Yu Rong', 'Ziwei Liu', 'Cheng Li', 'Kaidi Cao', 'Chen Change Loy']",CoRR,2019
307,i,Robust Multi-Modality Multi-Object Tracking.,"['Wenwei Zhang', 'Hui Zhou', 'Shuyang Sun', 'Zhe Wang', 'Jianping Shi', 'Chen Change Loy']",CoRR,2019
308,i,Learning to Synthesize Fashion Textures.,"['Wu Shi', 'Tak-Wai Hui', 'Ziwei Liu', 'Dahua Lin', 'Chen Change Loy']",CoRR,2019
309,i,Side-Aware Boundary Localization for More Precise Object Detection.,"['Jiaqi Wang', 'Wenwei Zhang', 'Yuhang Cao', 'Kai Chen', 'Jiangmiao Pang', 'Tao Gong', 'Jianping Shi', 'Chen Change Loy', 'Dahua Lin']",CoRR,2019
310,i,Pose-Robust Face Recognition via Deep Residual Equivariant Mapping.,"['Kaidi Cao', 'Yu Rong', 'Cheng Li', 'Xiaoou Tang', 'Chen Change Loy']",CoRR,2018
311,i,Video Object Segmentation with Joint Re-identification and Attention-Aware Mask Propagation.,"['Xiaoxiao Li', 'Chen Change Loy']",CoRR,2018
312,i,Recovering Realistic Texture in Image Super-resolution by Deep Spatial Feature Transform.,"['Xintao Wang', 'Ke Yu', 'Chao Dong', 'Chen Change Loy']",CoRR,2018
313,i,Crafting a Toolchain for Image Restoration by Deep Reinforcement Learning.,"['Ke Yu', 'Chao Dong', 'Liang Lin', 'Chen Change Loy']",CoRR,2018
314,i,Optimizing Video Object Detection via a Scale-Time Lattice.,"['Kai Chen', 'Jiaqi Wang', 'Shuo Yang', 'Xingcheng Zhang', 'Yuanjun Xiong', 'Chen Change Loy', 'Dahua Lin']",CoRR,2018
315,i,LiteFlowNet: A Lightweight Convolutional Neural Network for Optical Flow Estimation.,"['Tak-Wai Hui', 'Xiaoou Tang', 'Chen Change Loy']",CoRR,2018
316,i,Deep Imbalanced Learning for Face Recognition and Attribute Prediction.,"['Chen Huang', 'Yining Li', 'Chen Change Loy', 'Xiaoou Tang']",CoRR,2018
317,i,Non-Local Recurrent Network for Image Restoration.,"['Ding Liu', 'Bihan Wen', 'Yuchen Fan', 'Chen Change Loy', 'Thomas S. Huang']",CoRR,2018
318,i,Zoom-Net: Mining Deep Feature Interactions for Visual Relationship Recognition.,"['Guojun Yin', 'Lu Sheng', 'Bin Liu', 'Nenghai Yu', 'Xiaogang Wang', 'Jing Shao', 'Chen Change Loy']",CoRR,2018
319,i,ReenactGAN: Learning to Reenact Faces via Boundary Transfer.,"['Wayne Wu', 'Yunxuan Zhang', 'Cheng Li', 'Chen Qian', 'Chen Change Loy']",CoRR,2018
320,i,The Devil of Face Recognition is in the Noise.,"['Fei Wang', 'Liren Chen', 'Cheng Li', 'Shiyao Huang', 'Yanjie Chen', 'Chen Qian', 'Chen Change Loy']",CoRR,2018
321,i,ESRGAN: Enhanced Super-Resolution Generative Adversarial Networks.,"['Xintao Wang', 'Ke Yu', 'Shixiang Wu', 'Jinjin Gu', 'Yihao Liu', 'Chao Dong', 'Chen Change Loy', 'Yu Qiao', 'Xiaoou Tang']",CoRR,2018
322,i,Consensus-Driven Propagation in Massive Unlabeled Data for Face Recognition.,"['Xiaohang Zhan', 'Ziwei Liu', 'Junjie Yan', 'Dahua Lin', 'Chen Change Loy']",CoRR,2018
323,i,Improving On-policy Learning with Statistical Reward Accumulation.,"['Yubin Deng', 'Ke Yu', 'Dahua Lin', 'Xiaoou Tang', 'Chen Change Loy']",CoRR,2018
324,i,Learning to Steer by Mimicking Features from Heterogeneous Auxiliary Networks.,"['Yuenan Hou', 'Zheng Ma', 'Chunxiao Liu', 'Chen Change Loy']",CoRR,2018
325,i,Deep Network Interpolation for Continuous Imagery Effect Transition.,"['Xintao Wang', 'Ke Yu', 'Chao Dong', 'Xiaoou Tang', 'Chen Change Loy']",CoRR,2018
326,i,Instance-level Facial Attributes Transfer with Geometry-Aware Flow.,"['Weidong Yin', 'Ziwei Liu', 'Chen Change Loy']",CoRR,2018
327,i,Feature Matters: A Stage-by-Stage Approach for Knowledge Transfer.,"['Mengya Gao', 'Yujun Shen', 'Quanquan Li', 'Chen Change Loy', 'Xiaoou Tang']",CoRR,2018
328,i,Faceness-Net: Face Detection through Deep Facial Part Responses.,"['Shuo Yang', 'Ping Luo', 'Chen Change Loy', 'Xiaoou Tang']",CoRR,2017
329,i,Not All Pixels Are Equal: Difficulty-aware Semantic Segmentation via Deep Layer Cascade.,"['Xiaoxiao Li', 'Ziwei Liu', 'Ping Luo', 'Chen Change Loy', 'Xiaoou Tang']",CoRR,2017
330,i,Robust and Fast Decoding of High-Capacity Color QR Codes for Mobile Applications.,"['Zhibo Yang', 'Huanle Xu', 'Jianyuan Deng', 'Chen Change Loy', 'Wing Cheong Lau']",CoRR,2017
331,i,Face Detection through Scale-Friendly Deep Convolutional Networks.,"['Shuo Yang', 'Yuanjun Xiong', 'Chen Change Loy', 'Xiaoou Tang']",CoRR,2017
332,i,Merge or Not? Learning to Group Faces via Imitation Learning.,"['Yue He', 'Kaidi Cao', 'Cheng Li', 'Chen Change Loy']",CoRR,2017
333,i,Aesthetic-Driven Image Enhancement by Adversarial Learning.,"['Yubin Deng', 'Chen Change Loy', 'Xiaoou Tang']",CoRR,2017
334,i,Discover and Learn New Objects from Documentaries.,"['Kai Chen', 'Hang Song', 'Chen Change Loy', 'Dahua Lin']",CoRR,2017
335,i,Video Object Segmentation with Re-identification.,"['Xiaoxiao Li', 'Yuankai Qi', 'Zhe Wang', 'Kai Chen', 'Ziwei Liu', 'Jianping Shi', 'Ping Luo', 'Xiaoou Tang', 'Chen Change Loy']",CoRR,2017
336,i,Learning to Disambiguate by Asking Discriminative Questions.,"['Yining Li', 'Chen Huang', 'Xiaoou Tang', 'Chen Change Loy']",CoRR,2017
337,i,Quantifying Facial Age by Posterior of Age Comparisons.,"['Yunxuan Zhang', 'Li Liu', 'Cheng Li', 'Chen Change Loy']",CoRR,2017
338,i,Be Your Own Prada: Fashion Synthesis with Structural Coherence.,"['Shizhan Zhu', 'Sanja Fidler', 'Raquel Urtasun', 'Dahua Lin', 'Chen Change Loy']",CoRR,2017
339,i,Mix-and-Match Tuning for Self-Supervised Semantic Segmentation.,"['Xiaohang Zhan', 'Ziwei Liu', 'Ping Luo', 'Xiaoou Tang', 'Chen Change Loy']",CoRR,2017
340,i,Discriminative Sparse Neighbor Approximation for Imbalanced Learning.,"['Chen Huang', 'Chen Change Loy', 'Xiaoou Tang']",CoRR,2016
341,i,Deep Learning Markov Random Field for Semantic Segmentation.,"['Ziwei Liu', 'Xiaoxiao Li', 'Ping Luo', 'Chen Change Loy', 'Xiaoou Tang']",CoRR,2016
342,i,Deep Cascaded Bi-Network for Face Hallucination.,"['Shizhan Zhu', 'Sifei Liu', 'Chen Change Loy', 'Xiaoou Tang']",CoRR,2016
343,i,Accelerating the Super-Resolution Convolutional Neural Network.,"['Chao Dong', 'Chen Change Loy', 'Xiaoou Tang']",CoRR,2016
344,i,Deep Convolution Networks for Compression Artifacts Reduction.,"['Ke Yu', 'Chao Dong', 'Chen Change Loy', 'Xiaoou Tang']",CoRR,2016
345,i,From Facial Expression Recognition to Interpersonal Relation Prediction.,"['Zhanpeng Zhang', 'Ping Luo', 'Chen Change Loy', 'Xiaoou Tang']",CoRR,2016
346,i,Image Aesthetic Assessment: An Experimental Survey.,"['Yubin Deng', 'Chen Change Loy', 'Xiaoou Tang']",CoRR,2016
347,i,Local Similarity-Aware Deep Feature Embedding.,"['Chen Huang', 'Chen Change Loy', 'Xiaoou Tang']",CoRR,2016
348,i,PolyNet: A Pursuit of Structural Diversity in Very Deep Networks.,"['Xingcheng Zhang', 'Zhizhong Li', 'Chen Change Loy', 'Dahua Lin']",CoRR,2016
349,i,Image Super-Resolution Using Deep Convolutional Networks.,"['Chao Dong', 'Chen Change Loy', 'Kaiming He', 'Xiaoou Tang']",CoRR,2015
350,i,Learning to Recognize Pedestrian Attribute.,"['Yubin Deng', 'Ping Luo', 'Chen Change Loy', 'Xiaoou Tang']",CoRR,2015
351,i,Multi-Source Video Summarisation.,"['Xiatian Zhu', 'Chen Change Loy', 'Shaogang Gong']",CoRR,2015
352,i,Compression Artifacts Reduction by a Deep Convolutional Network.,"['Chao Dong', 'Yubin Deng', 'Chen Change Loy', 'Xiaoou Tang']",CoRR,2015
353,i,Boosting Optical Character Recognition: A Super-Resolution Approach.,"['Chao Dong', 'Ximei Zhu', 'Yubin Deng', 'Chen Change Loy', 'Yu Qiao']",CoRR,2015
354,i,Reading Scene Text in Deep Convolutional Sequences.,"['Pan He', 'Weilin Huang', 'Yu Qiao', 'Chen Change Loy', 'Xiaoou Tang']",CoRR,2015
355,i,A Large-Scale Car Dataset for Fine-Grained Categorization and Verification.,"['Linjie Yang', 'Ping Luo', 'Chen Change Loy', 'Xiaoou Tang']",CoRR,2015
356,i,Semantic Image Segmentation via Deep Parsing Network.,"['Ziwei Liu', 'Xiaoxiao Li', 'Ping Luo', 'Chen Change Loy', 'Xiaoou Tang']",CoRR,2015
357,i,Learning Social Relation Traits from Face Images.,"['Zhanpeng Zhang', 'Ping Luo', 'Chen Change Loy', 'Xiaoou Tang']",CoRR,2015
358,i,From Facial Parts Responses to Face Detection: A Deep Learning Approach.,"['Shuo Yang', 'Ping Luo', 'Chen Change Loy', 'Xiaoou Tang']",CoRR,2015
359,i,An Empirical Study of Recent Face Alignment Methods.,"['Heng Yang', 'Xuhui Jia', 'Chen Change Loy', 'Peter Robinson']",CoRR,2015
360,i,WIDER FACE: A Face Detection Benchmark.,"['Shuo Yang', 'Ping Luo', 'Chen Change Loy', 'Xiaoou Tang']",CoRR,2015
361,i,Towards Arbitrary-View Face Alignment by Recommendation Trees.,"['Shizhan Zhu', 'Cheng Li', 'Chen Change Loy', 'Xiaoou Tang']",CoRR,2015
362,i,Learning and Transferring Multi-task Deep Representation for Face Alignment.,"['Zhanpeng Zhang', 'Ping Luo', 'Chen Change Loy', 'Xiaoou Tang']",CoRR,2014
363,i,Transferring Landmark Annotations for Cross-Dataset Face Alignment.,"['Shizhan Zhu', 'Cheng Li', 'Chen Change Loy', 'Xiaoou Tang']",CoRR,2014
364,i,DeepID-Net: multi-stage and deformable deep convolutional neural networks for object detection.,"['Wanli Ouyang', 'Ping Luo', 'Xingyu Zeng', 'Shi Qiu', 'Yonglong Tian', 'Hongsheng Li', 'Shuo Yang', 'Zhe Wang', 'Yuanjun Xiong', 'Chen Qian', 'Zhenyao Zhu', 'Ruohui Wang', 'Chen Change Loy', 'Xiaogang Wang', 'Xiaoou Tang']",CoRR,2014
365,i,Crowd Saliency Detection via Global Similarity Structure.,"['Mei Kuan Lim', 'Ven Jyn Kok', 'Chen Change Loy', 'Chee Seng Chan']",CoRR,2014
366,i,DeepID-Net: Deformable Deep Convolutional Neural Networks for Object Detection.,"['Wanli Ouyang', 'Xiaogang Wang', 'Xingyu Zeng', 'Shi Qiu', 'Ping Luo', 'Yonglong Tian', 'Hongsheng Li', 'Shuo Yang', 'Zhe Wang', 'Chen Change Loy', 'Xiaoou Tang']",CoRR,2014
367,p,Talking Faces: Audio-to-Video Face Generation.,"['Yuxin Wang', 'Linsen Song', 'Wayne Wu', 'Chen Qian', 'Ran He', 'Chen Change Loy']",Handbook of Digital Face Manipulation and Detection,2022
368,p,DeepFakes Detection: the DeeperForensicsDeeperForensics Dataset and Challenge.,"['Liming Jiang', 'Wayne Wu', 'Chen Qian', 'Chen Change Loy']",Handbook of Digital Face Manipulation and Detection,2022
369,p,Deep Learning for Scene-Independent Crowd Analysis.,"['Xiaogang Wang', 'Chen Change Loy']",Group and Crowd Behavior for Computer Vision,2017
370,p,The Re-identification Challenge.,"['Shaogang Gong', 'Marco Cristani', 'Chen Change Loy', 'Timothy M. Hospedales']",Person Re-Identification,2014
371,p,Evaluating Feature Importance for Re-identification.,"['Chunxiao Liu', 'Shaogang Gong', 'Chen Change Loy', 'Xinggang Lin']",Person Re-Identification,2014
372,p,Crowd Counting and Profiling: Methodology and Evaluation.,"['Chen Change Loy', 'Ke Chen', 'Shaogang Gong', 'Tao Xiang']","Modeling, Simulation and Visual Analysis of Crowds",2013
373,p,Security and Surveillance.,"['Shaogang Gong', 'Chen Change Loy', 'Tao Xiang']",Visual Analysis of Humans,2011
374,e,Person Re-Identification.,"['Shaogang Gong', 'Marco Cristani', 'Shuicheng Yan', 'Chen Change Loy']",Advances in Computer Vision and Pattern Recognition,2014
