,type,name,author,event,year
0,j,Real-time dynamic network learning for location inference modelling and computing.,"['Jianxin Li', 'Aixin Sun', 'Ziyu Guan', 'Muhammad Aamir Cheema', 'Geyong Min']",Neurocomputing,2022
1,j,Natural Language Video Localization: A Revisit in Span-Based Question Answering Framework.,"['Hao Zhang', 'Aixin Sun', 'Wei Jing', 'Liangli Zhen', 'Joey Tianyi Zhou', 'Rick Siow Mong Goh']",IEEE Trans. Pattern Anal. Mach. Intell.,2022
2,j,A Survey on Deep Learning for Named Entity Recognition.,"['Jing Li', 'Aixin Sun', 'Jianglei Han', 'Chenliang Li']",IEEE Trans. Knowl. Data Eng.,2022
3,j,Point-of-Interest Recommendation With Global and Local Context.,"['Peng Han', 'Shuo Shang', 'Aixin Sun', 'Peilin Zhao', 'Kai Zheng', 'Xiangliang Zhang']",IEEE Trans. Knowl. Data Eng.,2022
4,j,Understanding the stability of medical concept embeddings.,"['Grace E. Lee', 'Aixin Sun']",J. Assoc. Inf. Sci. Technol.,2021
5,j,Will Your Paper Get Promoted by a Citation? A Case Study of Citation Promoter in Computer Science Discipline.,"['Feiheng Luo', 'Aixin Sun', 'Aravind Sesagiri Raamkumar', 'Mojisola Erdt', 'Yin-Leng Theng']",IEEE Trans. Emerg. Top. Comput.,2021
6,j,Incremental Community Detection on Large Complex Attributed Network.,"['Zhe Chen', 'Aixin Sun', 'Xiaokui Xiao']",ACM Trans. Knowl. Discov. Data,2021
7,j,Neural Named Entity Boundary Detection.,"['Jing Li', 'Aixin Sun', 'Yukun Ma']",IEEE Trans. Knowl. Data Eng.,2021
8,j,NEXT: a neural network framework for next POI recommendation.,"['Zhiqian Zhang', 'Chenliang Li', 'Zhiyong Wu', 'Aixin Sun', 'Dengpan Ye', 'Xiangyang Luo']",Frontiers Comput. Sci.,2020
9,j,Collective Named Entity Recognition in User Comments via Parameterized Label Propagation.,"['Minh C. Phan', 'Aixin Sun']",J. Assoc. Inf. Sci. Technol.,2020
10,j,Efficient approximation algorithms for adaptive influence maximization.,"['Keke Huang', 'Jing Tang', 'Kai Han', 'Xiaokui Xiao', 'Wei Chen', 'Aixin Sun', 'Xueyan Tang', 'Andrew Lim']",VLDB J.,2020
11,j,Deep Learning Based Recommender System: A Survey and New Perspectives.,"['Shuai Zhang', 'Lina Yao', 'Aixin Sun', 'Yi Tay']",ACM Comput. Surv.,2019
12,j,Collecting event-related tweets from twitter stream.,"['Xin Zheng', 'Aixin Sun']",J. Assoc. Inf. Sci. Technol.,2019
13,j,Pair-Linking for Collective Entity Disambiguation: Two Could Be Better Than All.,"['Minh C. Phan', 'Aixin Sun', 'Yi Tay', 'Jialong Han', 'Chenliang Li']",IEEE Trans. Knowl. Data Eng.,2019
14,j,Learning-Based Outdoor Localization Exploiting Crowd-Labeled WiFi Hotspots.,"['Jin Wang', 'Jun Luo', 'Sinno Jialin Pan', 'Aixin Sun']",IEEE Trans. Mob. Comput.,2019
15,j,Seed-Guided Topic Model for Document Filtering and Classification.,"['Chenliang Li', 'Shiqian Chen', 'Jian Xing', 'Aixin Sun', 'Zongyang Ma']",ACM Trans. Inf. Syst.,2019
16,j,LinkLive: discovering Web learning resources for developers from Q&A discussions.,"['Jing Li', 'Zhenchang Xing', 'Aixin Sun']",World Wide Web,2019
17,j,Joint Implicit and Explicit Neural Networks for Question Recommendation in CQA Services.,"['Hongkui Tu', 'Jiahui Wen', 'Aixin Sun', 'Xiaodong Wang']",IEEE Access,2018
18,j,Learning to answer programming questions with software documentation through social context embedding.,"['Jing Li', 'Aixin Sun', 'Zhenchang Xing']",Inf. Sci.,2018
19,j,To Do or Not To Do: Distill crowdsourced negative caveats to augment api documentation.,"['Jing Li', 'Aixin Sun', 'Zhenchang Xing']",J. Assoc. Inf. Sci. Technol.,2018
20,j,A time-aware trajectory embedding model for next-location recommendation.,"['Wayne Xin Zhao', 'Ningnan Zhou', 'Aixin Sun', 'Ji-Rong Wen', 'Jialong Han', 'Edward Y. Chang']",Knowl. Inf. Syst.,2018
21,j,Efficient Algorithms for Adaptive Influence Maximization.,"['Kai Han', 'Keke Huang', 'Xiaokui Xiao', 'Jing Tang', 'Aixin Sun', 'Xueyan Tang']",Proc. VLDB Endow.,2018
22,j,Exploring prestigious citations sourced from top universities in bibliometrics and altmetrics: a case study in the computer science discipline.,"['Feiheng Luo', 'Aixin Sun', 'Mojisola Erdt', 'Aravind Sesagiri Raamkumar', 'Yin-Leng Theng']",Scientometrics,2018
23,j,Semi-Supervised Spam Detection in Twitter Stream.,"['Surendra Sedhai', 'Aixin Sun']",IEEE Trans. Comput. Soc. Syst.,2018
24,j,Linking Fine-Grained Locations in User Comments.,"['Jialong Han', 'Aixin Sun', 'Gao Cong', 'Wayne Xin Zhao', 'Zongcheng Ji', 'Minh C. Phan']",IEEE Trans. Knowl. Data Eng.,2018
25,j,A Survey of Location Prediction on Twitter.,"['Xin Zheng', 'Jialong Han', 'Aixin Sun']",IEEE Trans. Knowl. Data Eng.,2018
26,j,Correction to A Survey of Location Prediction on Twitter.,"['Xin Zheng', 'Jialong Han', 'Aixin Sun']",IEEE Trans. Knowl. Data Eng.,2018
27,j,An analysis of 14 Million tweets on hashtag-oriented spamming.,"['Surendra Sedhai', 'Aixin Sun']",J. Assoc. Inf. Sci. Technol.,2017
28,j,Extracting fine-grained location with temporal awareness in tweets: A two-stage approach.,"['Chenliang Li', 'Aixin Sun']",J. Assoc. Inf. Sci. Technol.,2017
29,j,Searching for the internet of things: where it is and what it looks like.,"['Ali Shemshadi', 'Quan Z. Sheng', 'Yongrui Qin', 'Aixin Sun', 'Wei Emma Zhang', 'Lina Yao']",Pers. Ubiquitous Comput.,2017
30,j,Enhancing Topic Modeling for Short Texts with Auxiliary Word Embeddings.,"['Chenliang Li', 'Yu Duan', 'Haoran Wang', 'Zhiqian Zhang', 'Aixin Sun', 'Zongyang Ma']",ACM Trans. Inf. Syst.,2017
31,j,Mobile phone name extraction from internet forums: a semi-supervised approach.,"['Yangjie Yao', 'Aixin Sun']",World Wide Web,2016
32,j,PRISM: Concept-preserving Summarization of Top-K Social Image Search Results.,"['Boon-Siew Seah', 'Sourav S. Bhowmick', 'Aixin Sun']",Proc. VLDB Endow.,2015
33,j,Tweet Segmentation and Its Application to Named Entity Recognition.,"['Chenliang Li', 'Aixin Sun', 'Jianshu Weng', 'Qi He']",IEEE Trans. Knowl. Data Eng.,2015
34,j,"Who, Where, When, and What: A Nonparametric Bayesian Approach to Context-aware Recommendation and Search for Twitter Users.","['Quan Yuan', 'Gao Cong', 'Kaiqi Zhao', 'Zongyang Ma', 'Aixin Sun']",ACM Trans. Inf. Syst.,2015
35,j,Conformity-aware influence maximization in online social networks.,"['Hui Li', 'Sourav S. Bhowmick', 'Aixin Sun', 'Jiangtao Cui']",VLDB J.,2015
36,j,Affinity-driven blog cascade analysis and prediction.,"['Hui Li', 'Sourav S. Bhowmick', 'Aixin Sun', 'Jiangtao Cui']",Data Min. Knowl. Discov.,2014
37,j,TSDW: Two-stage word sense disambiguation using Wikipedia.,"['Chenliang Li', 'Aixin Sun', 'Anwitaman Datta']",J. Assoc. Inf. Sci. Technol.,2013
38,j,On predicting the popularity of newly emerging hashtags in Twitter.,"['Zongyang Ma', 'Aixin Sun', 'Gao Cong']",J. Assoc. Inf. Sci. Technol.,2013
39,j,An evaluation of classification models for question topic categorization.,"['Bo Qu', 'Gao Cong', 'Cuiping Li', 'Aixin Sun', 'Hong Chen']",J. Assoc. Inf. Sci. Technol.,2012
40,j,Mining latent relations in peer-production environments: a case study with Wikipedia article similarity and controversy.,"['Chenliang Li', 'Anwitaman Datta', 'Aixin Sun']",Soc. Netw. Anal. Min.,2012
41,j,Web classification of conceptual entities using co-training.,"['Aixin Sun', 'Ying Liu', 'Ee-Peng Lim']",Expert Syst. Appl.,2011
42,j,Detecting spam blogs from blog search results.,"['Linhong Zhu', 'Aixin Sun', 'Byron Choi']",Inf. Process. Manag.,2011
43,j,AffRank,"['Hui Li', 'Sourav S. Bhowmick', 'Aixin Sun']",J. Assoc. Inf. Sci. Technol.,2011
44,j,Tag-based social image retrieval: An empirical evaluation.,"['Aixin Sun', 'Sourav S. Bhowmick', 'Khanh Tran Nam Nguyen', 'Ge Bai']",J. Assoc. Inf. Sci. Technol.,2011
45,j,Query-Guided Event Detection From News and Blog Streams.,"['Aixin Sun', 'Meishan Hu']",IEEE Trans. Syst. Man Cybern. Part A,2011
46,j,iAVATAR: An Interactive Tool for Finding and Visualizing Visual-Representative Tags in Image Search.,"['Aixin Sun', 'Sourav S. Bhowmick', 'Yao Liu']",Proc. VLDB Endow.,2010
47,j,On strategies for imbalanced text classification using SVM: A comparative study.,"['Aixin Sun', 'Ee-Peng Lim', 'Ying Liu']",Decis. Support Syst.,2009
48,j,Imbalanced text classification: A term weighting approach.,"['Ying Liu', 'Han Tong Loh', 'Aixin Sun']",Expert Syst. Appl.,2009
49,j,Web unit-based mining of homepage relationships.,"['Aixin Sun', 'Ee-Peng Lim']",J. Assoc. Inf. Sci. Technol.,2006
50,j,An Energy-Efficient and Access Latency Optimized Indexing Scheme for Wireless Data Broadcast.,"['Yuxia Yao', 'Xueyan Tang', 'Ee-Peng Lim', 'Aixin Sun']",IEEE Trans. Knowl. Data Eng.,2006
51,j,Finding and classifying web units in websites.,"['Aixin Sun', 'Ee-Peng Lim']",Int. J. Bus. Intell. Data Min.,2005
52,j,Discovery of Concept Entities from Web Sites using Web Unit Mining.,"['Ming Yin', 'Dion Hoe-Lian Goh', 'Ee-Peng Lim', 'Aixin Sun']",Int. J. Web Inf. Syst.,2005
53,j,Web data extraction based on structural similarity.,"['Zhao Li', 'Wee Keong Ng', 'Aixin Sun']",Knowl. Inf. Syst.,2005
54,j,Blocking Reduction Strategies in Hierarchical Text Classification.,"['Aixin Sun', 'Ee-Peng Lim', 'Wee Keong Ng', 'Jaideep Srivastava']",IEEE Trans. Knowl. Data Eng.,2004
55,j,Performance measurement framework for hierarchical text classification.,"['Aixin Sun', 'Ee-Peng Lim', 'Wee Keong Ng']",J. Assoc. Inf. Sci. Technol.,2003
56,c,MMEKG: Multi-modal Event Knowledge Graph towards Universal Representation across Modalities.,"['Yubo Ma', 'Zehao Wang', 'Mukai Li', 'Yixin Cao', 'Meiqi Chen', 'Xinze Li', 'Wenqi Sun', 'Kunquan Deng', 'Kun Wang', 'Aixin Sun', 'Jing Shao']",ACL (demo),2022
57,c,CofeNet: Context and Former-Label Enhanced Net for Complicated Quotation Extraction.,"['Yequan Wang', 'Xiang Li', 'Aixin Sun', 'Xuying Meng', 'Huaming Liao', 'Jiafeng Guo']",COLING,2022
58,c,An Embarrassingly Simple Model for Dialogue Relation Extraction.,"['Fuzhao Xue', 'Aixin Sun', 'Hao Zhang', 'Jinjie Ni', 'Eng Siong Chng']",ICASSP,2022
59,c,Do Loyal Users Enjoy Better Recommendations?: Understanding Recommender Accuracy from a Time Perspective.,"['Yitong Ji', 'Aixin Sun', 'Jie Zhang', 'Chenliang Li']",ICTIR,2022
60,c,A Survey on Neural Open Information Extraction: Current Status and Future Directions.,"['Shaowen Zhou', 'Bowen Yu', 'Aixin Sun', 'Cheng Long', 'Jingyang Li', 'Jian Sun']",IJCAI,2022
61,c,A Dual-Channel Framework for Sarcasm Recognition by Detecting Sentiment Conflict.,"['Yiyi Liu', 'Yequan Wang', 'Aixin Sun', 'Xuying Meng', 'Jing Li', 'Jiafeng Guo']",NAACL-HLT (Findings),2022
62,c,Aspect-Based Sentiment Analysis Through EDU-Level Attentions.,"['Ting Lin', 'Aixin Sun', 'Yequan Wang']",PAKDD (1),2022
63,c,Automatic Expert Selection for Multi-Scenario and Multi-Task Search.,"['Xinyu Zou', 'Zhi Hu', 'Yiming Zhao', 'Xuchu Ding', 'Zhongyi Liu', 'Chenliang Li', 'Aixin Sun']",SIGIR,2022
64,c,An Attribute-Driven Mirror Graph Network for Session-based Recommendation.,"['Siqi Lai', 'Erli Meng', 'Fan Zhang', 'Chenliang Li', 'Bin Wang', 'Aixin Sun']",SIGIR,2022
65,c,Improving Conversational Recommender Systems via Transformer-based Sequential Modelling.,"['Jie Zou', 'Evangelos Kanoulas', 'Pengjie Ren', 'Zhaochun Ren', 'Aixin Sun', 'Cheng Long']",SIGIR,2022
66,c,GDPNet: Refining Latent Multi-View Graph for Relation Extraction.,"['Fuzhao Xue', 'Aixin Sun', 'Hao Zhang', 'Eng Siong Chng']",AAAI,2021
67,c,Parallel Attention Network with Sequence Matching for Video Grounding.,"['Hao Zhang', 'Aixin Sun', 'Wei Jing', 'Liangli Zhen', 'Joey Tianyi Zhou', 'Rick Siow Mong Goh']",ACL/IJCNLP (Findings),2021
68,c,DocOIE: A Document-level Context-Aware Dataset for OpenIE.,"['Kuicai Dong', 'Yilin Zhao', 'Aixin Sun', 'Jung-Jae Kim', 'Xiaoli Li']",ACL/IJCNLP (Findings),2021
69,c,Generative Inverse Deep Reinforcement Learning for Online Recommendation.,"['Xiaocong Chen', 'Lina Yao', 'Aixin Sun', 'Xianzhi Wang', 'Xiwei Xu', 'Liming Zhu']",CIKM,2021
70,c,Pre-training Graph Transformer with Multimodal Side Information for Recommendation.,"['Yong Liu', 'Susen Yang', 'Chenyi Lei', 'Guoxin Wang', 'Haihong Tang', 'Juyong Zhang', 'Aixin Sun', 'Chunyan Miao']",ACM Multimedia,2021
71,c,Video Corpus Moment Retrieval with Contrastive Learning.,"['Hao Zhang', 'Aixin Sun', 'Wei Jing', 'Guoshun Nan', 'Liangli Zhen', 'Joey Tianyi Zhou', 'Rick Siow Mong Goh']",SIGIR,2021
72,c,Tweet-aware News Summarization with Dual-Attention Mechanism.,"['Xin Zheng', 'Aixin Sun', 'Karthik Muthuswamy']",WWW (Companion Volume),2021
73,c,DeepRouting: A Deep Neural Network Approach for Ticket Routing in Expert Network.,"['Jianglei Han', 'Aixin Sun']",SCC,2020
74,c,CASE: Context-Aware Semantic Expansion.,"['Jialong Han', 'Aixin Sun', 'Haisong Zhang', 'Chenliang Li', 'Shuming Shi']",AAAI,2020
75,c,Span-based Localizing Network for Natural Language Video Localization.,"['Hao Zhang', 'Aixin Sun', 'Wei Jing', 'Joey Tianyi Zhou']",ACL,2020
76,c,Efficient Approximation Algorithms for Adaptive Target Profit Maximization.,"['Keke Huang', 'Jing Tang', 'Xiaokui Xiao', 'Aixin Sun', 'Andrew Lim']",ICDE,2020
77,c,Anomaly Detection on Dynamic Bipartite Graph with Burstiness.,"['Zhe Chen', 'Aixin Sun']",ICDM,2020
78,c,Sentiment Prediction using Attention on User-Specific Rating Distribution.,"['Ting Lin', 'Aixin Sun']",ICTIR,2020
79,c,CATN: Cross-Domain Recommendation for Cold-Start Users via Aspect Transfer Network.,"['Cheng Zhao', 'Chenliang Li', 'Rong Xiao', 'Hongbo Deng', 'Aixin Sun']",SIGIR,2020
80,c,A Re-visit of the Popularity Baseline in Recommender Systems.,"['Yitong Ji', 'Aixin Sun', 'Jie Zhang', 'Chenliang Li']",SIGIR,2020
81,c,ChID: A Large-scale Chinese IDiom Dataset for Cloze Test.,"['Chujie Zheng', 'Minlie Huang', 'Aixin Sun']",ACL (1),2019
82,c,Robust Representation Learning of Biomedical Names.,"['Minh C. Phan', 'Aixin Sun', 'Yi Tay']",ACL (1),2019
83,c,Subtopic-driven Multi-Document Summarization.,"['Xin Zheng', 'Aixin Sun', 'Jing Li', 'Karthik Muthuswamy']",EMNLP/IJCNLP (1),2019
84,c,AUC-MF: Point of Interest Recommendation with AUC Maximization.,"['Peng Han', 'Shuo Shang', 'Aixin Sun', 'Peilin Zhao', 'Kai Zheng', 'Panos Kalnis']",ICDE,2019
85,c,DeepRec: An Open-source Toolkit for Deep Learning based Recommendation.,"['Shuai Zhang', 'Yi Tay', 'Lina Yao', 'Bin Wu', 'Aixin Sun']",IJCAI,2019
86,c,Community Detection on Large Complex Attribute Network.,"['Chen Zhe', 'Aixin Sun', 'Xiaokui Xiao']",KDD,2019
87,c,A Study on Agreement in PICO Span Annotations.,"['Grace E. Lee', 'Aixin Sun']",SIGIR,2019
88,c,Efficient Approximation Algorithms for Adaptive Seed Minimization.,"['Jing Tang', 'Keke Huang', 'Xiaokui Xiao', 'Laks V. S. Lakshmanan', 'Xueyan Tang', 'Aixin Sun', 'Andrew Lim']",SIGMOD Conference,2019
89,c,Learning Travel Time Distributions with Deep Generative Model.,"['Xiucheng Li', 'Gao Cong', 'Aixin Sun', 'Yun Cheng']",WWW,2019
90,c,Aspect-level Sentiment Analysis using AS-Capsules.,"['Yequan Wang', 'Aixin Sun', 'Minlie Huang', 'Xiaoyan Zhu']",WWW,2019
91,c,Towards Effective Extraction and Linking of Software Mentions from User-Generated Support Tickets.,"['Jianglei Han', 'Ka Hian Goh', 'Aixin Sun', 'Mohammad Akbari']",CIKM,2018
92,c,Linking Fine-Grained Locations in User Comments (Extended Abstract).,"['Jialong Han', 'Aixin Sun', 'Gao Cong', 'Wayne Xin Zhao', 'Zongcheng Ji', 'Minh C. Phan']",ICDE,2018
93,c,NeuRec: On Nonlinear Transformation for Personalized Ranking.,"['Shuai Zhang', 'Lina Yao', 'Aixin Sun', 'Sen Wang', 'Guodong Long', 'Manqing Dong']",IJCAI,2018
94,c,SegBot: A Generic Neural Text Segmentation Model with Pointer Network.,"['Jing Li', 'Aixin Sun', 'Shafiq R. Joty']",IJCAI,2018
95,c,Seed-driven Document Ranking for Systematic Reviews in Evidence-Based Medicine.,"['Grace E. Lee', 'Aixin Sun']",SIGIR,2018
96,c,Killing Two Birds With One Stone: Concurrent Ranking of Tags and Comments of Social Images.,"['Boon-Siew Seah', 'Aixin Sun', 'Sourav S. Bhowmick']",SIGIR,2018
97,c,CoNEREL: Collective Information Extraction in News Articles.,"['Minh C. Phan', 'Aixin Sun']",SIGIR,2018
98,c,API Caveat Explorer - Surfacing Negative Usages from Practice: An API-oriented Interactive Exploratory Search System for Programmers.,"['Jing Li', 'Aixin Sun', 'Zhenchang Xing', 'Lei Han']",SIGIR,2018
99,c,Sentiment Analysis by Capsules.,"['Yequan Wang', 'Aixin Sun', 'Jialong Han', 'Ying Liu', 'Xiaoyan Zhu']",WWW,2018
100,c,Time Expression Analysis and Recognition Using Syntactic Token Types and General Heuristic Rules.,"['Xiaoshi Zhong', 'Aixin Sun', 'Erik Cambria']",ACL (1),2017
101,c,Entity Recognition by Distant Supervision with Soft List Constraint.,"['Hongkui Tu', 'Zongyang Ma', 'Aixin Sun', 'Zhiqiang Xu', 'Xiaodong Wang']",ADMA,2017
102,c,Exploring prestigious citations sourced from top universities across disciplines.,"['Feiheng Luo', 'Aixin Sun', 'Mojisola Erdt', 'Aravind Sesagiri Raamkumar', 'Yin-Leng Theng']",ASIST,2017
103,c,Semi-Supervised Event-related Tweet Identification with Dynamic Keyword Generation.,"['Xin Zheng', 'Aixin Sun', 'Sibo Wang', 'Jialong Han']",CIKM,2017
104,c,NeuPL: Attention-based Semantic Matching and Pair-Linking for Entity Disambiguation.,"['Minh C. Phan', 'Aixin Sun', 'Yi Tay', 'Jialong Han', 'Chenliang Li']",CIKM,2017
105,c,Mean Average Distance to Resolver: An Evaluation Metric for Ticket Routing in Expert Network.,"['Jianglei Han', 'Aixin Sun']",ICSME,2017
106,c,"Cross-Device User Linking: URL, Session, Visiting Time, and Device-log Embedding.","['Minh C. Phan', 'Aixin Sun', 'Yi Tay']",SIGIR,2017
107,c,When MetaMap Meets Social Media in Healthcare: Are the Word Labels Correct?,"['Hongkui Tu', 'Zongyang Ma', 'Aixin Sun', 'Xiaodong Wang']",AIRS,2016
108,c,Effective Document Labeling with Very Few Seed Words: A Topic Model Approach.,"['Chenliang Li', 'Jian Xing', 'Aixin Sun', 'Zongyang Ma']",CIKM,2016
109,c,Annotating Points of Interest with Geo-tagged Tweets.,"['Kaiqi Zhao', 'Gao Cong', 'Aixin Sun']",CIKM,2016
110,c,Discovering Neighborhood Pattern Queries by sample answers in knowledge base.,"['Jialong Han', 'Kai Zheng', 'Aixin Sun', 'Shuo Shang', 'Ji-Rong Wen']",ICDE,2016
111,c,Topic Modeling for Short Texts with Auxiliary Word Embeddings.,"['Chenliang Li', 'Haoran Wang', 'Zhiqian Zhang', 'Aixin Sun', 'Zongyang Ma']",SIGIR,2016
112,c,Effect of Spam on Hashtag Recommendation for Tweets.,"['Surendra Sedhai', 'Aixin Sun']",WWW (Companion Volume),2016
113,c,Joint Recognition and Linking of Fine-Grained Locations from Tweets.,"['Zongcheng Ji', 'Aixin Sun', 'Gao Cong', 'Jialong Han']",WWW,2016
114,c,A Tri-Role Topic Model for Domain-Specific Question Answering.,"['Zongyang Ma', 'Aixin Sun', 'Quan Yuan', 'Gao Cong']",AAAI,2015
115,c,A Study of Visual and Semantic Similarity for Social Image Search Recommendation.,"['Yangjie Yao', 'Aixin Sun']",AIRS,2015
116,c,Did You Know? A Rule-Based Approach to Finding Similar Questions on Online Health Forums.,"['Jianglei Han', 'Naveen Nandan', 'Aixin Sun']",ICHI,2015
117,c,A Boosting Algorithm for Item Recommendation with Implicit Feedback.,"['Yong Liu', 'Peilin Zhao', 'Aixin Sun', 'Chunyan Miao']",IJCAI,2015
118,c,HSpam14: A Collection of 14 Million Tweets for Hashtag-Oriented Spam Research.,"['Surendra Sedhai', 'Aixin Sun']",SIGIR,2015
119,c,Graph-based Point-of-interest Recommendation with Geographical and Temporal Influences.,"['Quan Yuan', 'Gao Cong', 'Aixin Sun']",CIKM,2014
120,c,Exploiting Geographical Neighborhood Characteristics for Location Recommendation.,"['Yong Liu', 'Wei Wei', 'Aixin Sun', 'Chunyan Miao']",CIKM,2014
121,c,Tagging Your Tweets: A Probabilistic Modeling of Hashtag Annotation in Twitter.,"['Zongyang Ma', 'Aixin Sun', 'Quan Yuan', 'Gao Cong']",CIKM,2014
122,c,Fine-grained location extraction from tweets with temporal awareness.,"['Chenliang Li', 'Aixin Sun']",SIGIR,2014
123,c,Your neighbors affect your ratings: on geographical neighborhood influence to rating prediction.,"['Longke Hu', 'Aixin Sun', 'Yong Liu']",SIGIR,2014
124,c,PRISM: concept-preserving social image search results summarization.,"['Boon-Siew Seah', 'Sourav S. Bhowmick', 'Aixin Sun']",SIGIR,2014
125,c,Hashtag recommendation for hyperlinked tweets.,"['Surendra Sedhai', 'Aixin Sun']",SIGIR,2014
126,c,Towards context-aware search with right click.,"['Aixin Sun', 'Chii-Hian Lou']",SIGIR,2014
127,c,"Why not, WINE?","['Sourav S. Bhowmick', 'Aixin Sun', 'Ba Quan Truong']",WWW (Companion Volume),2014
128,c,Summarizing social image search results.,"['Boon-Siew Seah', 'Sourav S. Bhowmick', 'Aixin Sun']",WWW (Companion Volume),2014
129,c,Are Most-Viewed News Articles Most-Shared?,"['Yangjie Yao', 'Aixin Sun']",AIRS,2013
130,c,Predicting event-relatedness of popular queries.,"['Seyyedeh Newsha Ghoreishi', 'Aixin Sun']",CIKM,2013
131,c,CINEMA: conformity-aware greedy algorithm for influence maximization in online social networks.,"['Hui Li', 'Sourav S. Bhowmick', 'Aixin Sun']",EDBT,2013
132,c,"Who, where, when and what: discover spatio-temporal topics for twitter users.","['Quan Yuan', 'Gao Cong', 'Zongyang Ma', 'Aixin Sun', 'Nadia Magnenat-Thalmann']",KDD,2013
133,c,"Why not, WINE?: towards answering why-not questions in social image search.","['Sourav S. Bhowmick', 'Aixin Sun', 'Ba Quan Truong']",ACM Multimedia,2013
134,c,Crest: Cluster-based Representation Enrichment for Short Text Classification.,"['Zichao Dai', 'Aixin Sun', 'Xu-Ying Liu']",PAKDD (2),2013
135,c,Time-aware point-of-interest recommendation.,"['Quan Yuan', 'Gao Cong', 'Zongyang Ma', 'Aixin Sun', 'Nadia Magnenat-Thalmann']",SIGIR,2013
136,c,Exploiting hybrid contexts for Tweet segmentation.,"['Chenliang Li', 'Aixin Sun', 'Jianshu Weng', 'Qi He']",SIGIR,2013
137,c,MESSIAH: missing element-conscious SLCA nodes search in XML data.,"['Ba Quan Truong', 'Sourav S. Bhowmick', 'Curtis E. Dyreson', 'Aixin Sun']",SIGMOD Conference,2013
138,c,Twevent: segment-based event detection from tweets.,"['Chenliang Li', 'Aixin Sun', 'Anwitaman Datta']",CIKM,2012
139,c,Topic-driven reader comments summarization.,"['Zongyang Ma', 'Aixin Sun', 'Quan Yuan', 'Gao Cong']",CIKM,2012
140,c,Content is still king: the effect of neighbor voting schemes on tag relevance for social image retrieval.,"['Ba Quan Truong', 'Aixin Sun', 'Sourav S. Bhowmick']",ICMR,2012
141,c,TwiNER: named entity recognition in targeted twitter stream.,"['Chenliang Li', 'Jianshu Weng', 'Qi He', 'Yuxia Yao', 'Anwitaman Datta', 'Aixin Sun', 'Bu-Sung Lee']",SIGIR,2012
142,c,Category hierarchy maintenance: a data-driven approach.,"['Quan Yuan', 'Gao Cong', 'Aixin Sun', 'Chin-Yew Lin', 'Nadia Magnenat-Thalmann']",SIGIR,2012
143,c,Short text classification using very few words.,['Aixin Sun'],SIGIR,2012
144,c,Will this #hashtag be popular tomorrow?,"['Zongyang Ma', 'Aixin Sun', 'Gao Cong']",SIGIR,2012
145,c,CASIS: a system for concept-aware social image search.,"['Ba Quan Truong', 'Aixin Sun', 'Sourav S. Bhowmick']",WWW (Companion Volume),2012
146,c,CASINO: towards conformity-aware social influence analysis in online social networks.,"['Hui Li', 'Sourav S. Bhowmick', 'Aixin Sun']",CIKM,2011
147,c,Managing Social Image Tags: Methods and Applications.,"['Aixin Sun', 'Sourav S. Bhowmick']",DASFAA (2),2011
148,c,A Generalized Method for Word Sense Disambiguation Based on Wikipedia.,"['Chenliang Li', 'Aixin Sun', 'Anwitaman Datta']",ECIR,2011
149,c,Social image tag recommendation by concept matching.,"['Aixin Sun', 'Sourav S. Bhowmick', 'Jun-An Chong']",ACM Multimedia,2011
150,c,Semantic tag recommendation using concept model.,"['Chenliang Li', 'Anwitaman Datta', 'Aixin Sun']",SIGIR,2011
151,c,Visualizing and querying semantic social networks.,"['Aixin Sun', 'Anwitaman Datta', 'Ee-Peng Lim', 'Kuiyu Chang']",SIGIR,2011
152,c,Investigating Perceptions of a Location-Based Annotation System.,"['Huynh Nhu Hop Quach', 'Khasfariyati Razikin', 'Dion Hoe-Lian Goh', 'Thi Nhu Quynh Kim', 'Tan Phat Pham', 'Yin Leng Theng', 'Ee-Peng Lim', 'Chew-Hung Chang', 'Kalyani Chatterjea', 'Aixin Sun']",AMT,2010
153,c,Affinity-driven prediction and ranking of products in online product review sites.,"['Hui Li', 'Sourav S. Bhowmick', 'Aixin Sun']",CIKM,2010
154,c,Visualizing and Exploring Evolving Information Networks in Wikipedia.,"['Ee-Peng Lim', 'Agus Trisnajaya Kwee', 'Nelman Lubis Ibrahim', 'Aixin Sun', 'Anwitaman Datta', 'Kuiyu Chang', 'Maureen']",ICADL,2010
155,c,Enhancing search in a geospatial multimedia annotation system.,"['Huynh Nhu Hop Quach', 'Dion Hoe-Lian Goh', 'Khasfariyati Razikin', 'Tan Phat Pham', 'Thi Nhu Quynh Kim', 'Yin Leng Theng', 'Ee-Peng Lim', 'Chew-Hung Chang', 'Kalyani Chatterjea', 'Aixin Sun']",iiWAS,2010
156,c,Managing Media Rich Geo-spatial Annotations for a Map-Based Mobile Application Using Clustering.,"['Khasfariyati Razikin', 'Dion Hoe-Lian Goh', 'Ee-Peng Lim', 'Aixin Sun', 'Yin Leng Theng', 'Thi Nhu Quynh Kim', 'Kalyani Chatterjea', 'Chew-Hung Chang']",ITNG,2010
157,c,Do Wikipedians follow domain experts?: a domain-specific study on Wikipedia knowledge building.,"['Yi Zhang', 'Aixin Sun', 'Anwitaman Datta', 'Kuiyu Chang', 'Ee-Peng Lim']",JCDL,2010
158,c,Quantifying tag representativeness of visual content of social images.,"['Aixin Sun', 'Sourav S. Bhowmick']",ACM Multimedia,2010
159,c,Do You Trust to Get Trust? A Study of Trust Reciprocity Behaviors and Reciprocal Trust Prediction.,"['Viet-An Nguyen', 'Ee-Peng Lim', 'Hwee-Hoon Tan', 'Jing Jiang', 'Aixin Sun']",SDM,2010
160,c,SSnetViz: a visualization engine for heterogeneous semantic social networks.,"['Ee-Peng Lim', 'Maureen', 'Nelman Lubis Ibrahim', 'Aixin Sun', 'Anwitaman Datta', 'Kuiyu Chang']",ICEC,2009
161,c,Sharing Mobile Multimedia Annotations to Support Inquiry-Based Learning Using MobiTOP.,"['Khasfariyati Razikin', 'Dion Hoe-Lian Goh', 'Yin Leng Theng', 'Quang Minh Nguyen', 'Thi Nhu Quynh Kim', 'Ee-Peng Lim', 'Chew-Hung Chang', 'Kalyani Chatterjea', 'Aixin Sun']",AMT,2009
162,c,Trust relationship prediction using online product review data.,"['Nan Ma', 'Ee-Peng Lim', 'Viet-An Nguyen', 'Aixin Sun', 'Haifeng Liu']",CIKM-CNIKM,2009
163,c,Blog cascade affinity: analysis and prediction.,"['Hui Li', 'Sourav S. Bhowmick', 'Aixin Sun']",CIKM,2009
