,type,name,author,event,year
289,c,LSP parameter interpretation for speech classification.,"['Ian Vince McLoughlin', 'Srikanthan Thambipillai']",ICECS,1999
290,c,New area efficient residue-to-weighted number system converters.,"['Jimson Mathew', 'D. Radhakrishnan', 'Thambipillai Srikanthan']",ICECS,1999
291,c,"Residue-to-binary arithmetic converter for moduli set {2n -1, 2n, 2n+1, 2n+1 -1}.","['Jimson Mathew', 'D. Radhakrishnan', 'Thambipillai Srikanthan']",NSIP,1999
292,c,An Object Oriented GUI for Clustering Technique Based Network Simulations.,"['Thambipillai Srikanthan', 'Gurdeep S. Hura', 'Chia Cher Yong']",ESM,1998
293,c,Designing efficient residue arithmetic based VLSI correlators.,"['Aniruddha A. Deodhar', 'Manish Bhardwaj', 'Christopher T. Clarke', 'Thambipillai Srikanthan']",ICASSP,1998
294,e,"Advances in Computer Systems Architecture, 10th Asia-Pacific Conference, ACSAC 2005, Singapore, October 24-26, 2005, Proceedings.","['Thambipillai Srikanthan', 'Jingling Xue', 'Chip-Hong Chang']",Lecture Notes in Computer Science,2005
